Name,Sector,City,Address,Phone,Email,Lat-Long
Neel Gems And Jewellery Pvt Ltd,Companies(Private),Delhi,"404/D-240, Narvik Mahiraj Apartment, 3rd Floor, Behari Marg, Bani Park, Jaipur 302016, RJ","+91-141-4025198, +91-141-2202297",",neelgemspvtltd@hotmail.com,",
N R Doshi & Associates ( Wingold Next ),Companies(Private),Delhi,"303, Shukun Arcade, Mithakhali, Ahmedabad 380006, GJ",-26561489,,
Micro International,Companies(Private),Delhi,"5/1, 2nd Floor, D Lane MBT Street, Ganigara, Bangalore 560002, KA",-22223661,",last@microtekdirect.com,kalpana.dubey@rvnl.org,aditya.rishi@microtekdirect.com,info@microplasticsindia.com,",
Manshapurna Chains Pvt Ltd,Companies(Private),Delhi,"105, Shop No 3, 1st Floor, Zaveri Bazar, Mumbai 400002, MH","+91-22-23434774, +91-22-22417612",",mashpurnachainsfs@gmail.com,manshapurnachainsfs@gmail.com,",
Lypsa Gems & Jewellery Ltd,Companies(Private),Delhi,"BC-6021, Bharat Diamond Bourse, Bandra Kurla Complex, Bandra East, Mumbai 400051, MH",-67413531,,
Khawad Creations,Companies(Private),Delhi,"601, Raja Park, Khawad, Sindhi Colony, Jaipur 302004, RJ","+91-141-2576000, +91-9829056561",,
Joyalukkas India Pvt Ltd,Companies(Private),Delhi,"Jwalika Trade, Marine Drive, Kochi 682031, KL",-2385428,",x3ecustomercare@joyalukkas.com,cs@joyalukkas.com,investors@joyalukkas.com,customercare@joyalukkas.com,",
Josco Jewellers Pvt Ltd,Companies(Private),Delhi,"Rajeev Gandhi Shopping Complex, Kottayam 686001, KL","+91-481-2303555, +91-481-2302666",",office@joscogroup.com,doejane@joscogroup.com,joscoeastfort@joscogroup.com,",
Jineshwar Ornaments,Companies(Private),Delhi,"7/8, Mohan Chambers, Bandhara, Ahmedabad 380001, GJ",-22143642,",cs@mokshornaments.com,rk@rknco.com,",
Jaipur Gems,Companies(Private),Delhi,"2, Dharam Palace, Hughes Road, Mumbai 400007, MH",-23631819,",jaipurcollective@gmail.com,nitin.khandelwal@gjepcindia.com,delhi@gjepcindia.com,customer.service@jaipurgems.com,",
J B And Brothers Pvt Ltd,Companies(Private),Delhi,"FC-3011/12, 3rd Floor, Bharat Diamond Bourse, Bandra Kurla Complex, Bandra East, Mumbai 400051, MH","+91-22-40342222, +91-22-23631424",",jbbmbi@jbbodamail.com,last@jbbrothers.com,info@jbbrothers.com,",
Hemraj jewellery Craft,Companies(Private),Delhi,"Near Sauluka Agency, Naya Sadak, Cuttak 753002, OD","+91-671-2522717, +91-8049186363",",sharda.corporation@gmail.com,",
H K Jewels Pvt Ltd,Companies(Private),Delhi,"1701-A, The Capital Building, 17th Floor, B Wing, Opposite ICICI Bank, Bandra Kurla Complex, Bandra East, Mumbai 400051, MH",-67159931,",pradeep.kumar@careratings.com,info@kisna.com,accounts@kisna.com,x3eaccounts@kisna.com,",
Fateh Chand Bansi Lal Jewellers,Companies(Private),Delhi,"Sarafa Bazar, Ambala Cantt, Ambala 134003, HR",-2643425,"rishi.ellure@gmail.com,,support@fcbl.co,",
DP Designs Pvt Ltd,Companies(Private),Delhi,"A/17, Girikunj Industrial Estate, Off Mahakali Caves Road, Andheri East, Mumbai 400093, MH","+91-22-66165000, +91-22-26875566",",info@dpdesignsindia.com,",
Diacentre,Companies(Private),Delhi,"FC-9011, 9th Floor, F Tower, Centre Wing, Bharat Diamond Bourse, Bandra Kurla Complex, Bandra East, Mumbai 400051, MH",-26754231,,
Craft India Overseas,Companies(Private),Delhi,"301-302, Manjusha Chambers 12, Enclave Commercial Complex, Anand Vihar, New Delhi 110092, DL","+91-11-43035130, +91-9811021490",",info@craftvillage.org.in,craftindiaovs@gmail.com,aarbur@aarbur.com,Ashishrathore.82@gmail.com,",
Chemmanur Gold Refinery Pvt Ltd ( Chemmanur ),Companies(Private),Delhi,"39/6066, Alappat Road Extension, Ravipuram, Kochi 682015, KL","+91-484-2356746, +91-484-2356749",",mail@chemmanurrefinery.com,Corporateoffice@chemmanur.com,x3email@chemmanurinternational.com,chemmanurgoldaccounts@gmail.com,mail@chemmanurinternational.com,",
BRB Art & Jewels Pvt Ltd,Companies(Private),Delhi,"J-7, Near Bal Vinay Mandir School, Haridas Ji Ki Magri, Udaipur 313001, RJ",-9829042030,,
Bhupatrai Ratilal Zaveri,Companies(Private),Delhi,"Sun Plaza Complex, Swastik Society, Swastik Cross Road, Commerce College Road, Navrangpura, Ahmedabad 380009, GJ",-9825455060,",jayminjzaveri@gmail.com,",
Beliram Jewellers and Silversmiths,Companies(Private),Delhi,"SF-8, MGF Metropolitan Mall, 2nd Floor, M.G. Road, Gurgaon Haryana, 122002, HR",-4101325,",beliramsilverware@gmail.com,",
Bapalal & Co Jewellers,Companies(Private),Delhi,"37,Cathedral Road, Chennai 600086, TN","+91-44-28113030, +91-44-28112138","info@bapalalkeshavlal.com,,",
Arhamm Diamond Jewellery Pvt Ltd,Companies(Private),Delhi,"101/102, Adarsh Niwas, 1st Floor, 214 R R Mohan Roy Road, Charni Road, Mumbai 400004, MH",-9320750008,"ROYAL6947@GMAIL.COM,,",
Amore Jewels Pvt Ltd,Companies(Private),Delhi,"3-A, Near Itt Bhatti, Pandit Motilal Nehru Marg, Malad East, Mumbai 400063, MH",-40726604,",info@amorejewels.in,accounts@amorejewels.in,sales@LawyerServices.in,info@LawyerServices.in,",
A Geeripai Jewellery,Companies(Private),Delhi,"Lakshmi Chambers, Near Padma Theater, M.G. Road, Ernakulam 682035, KL","+91-484-4045050, +91-484-2352952",",shafeekh@malbargroup.com,",
Yash Packaging,Companies(Private),Delhi,"5, Manek Bhandari Compound, Jackeria Road, Malad West, Mumbai 400064, MH",-28808882,",info@yashpackagingindia.com,dcnahataco@hotmail.com,x3edcnahataco@hotmail.com,John@yashpackaging.com,info@gangesp.com,",
Winley Polymers Pvt Ltd,Companies(Private),Delhi,"N-59, MIDC Area, Jalgaon 425003, MH","+91-257-2213399, +91-257-2272988",",pridepet@sancharnet.in,pridepetgroup@gmail.com,",
White Plaast,Companies(Private),Delhi,"550/15, White?s, 4th Floor, D B Road, R S Puram, Coimbatore 641002, TN","+91-422-2546505, +91-422-2546186","Mail@Shalimarpack.Com,,info@espritoplast.com,pbi@kolsitegroup.com,",
Welset Polypack Pvt Ltd,Companies(Private),Delhi,"1-8-304/7, 10 & 11, Shyamal Arihant, 5th Floor, Pattit Gada Road, Secunderabad, Hyderabad 500003, TS",-27811321,",welsets@gmail.com,",
Vikram Plasticizer,Companies(Private),Delhi,"143, Shantiniketan Building, 3rd Floor, S V Road, Khar West, Mumbai 400052, MH","+91-22-26480231, +91-22-26480232",",jane@kljindia.com,atul1966@gmail.com,contact@vikramplast.comWe,info@bariumindia.com,",
Vichare Express & Logistics Pvt Ltd,Companies(Private),Delhi,"137-CD, 1st Floor, Government Industrial Estate, Associate Capsule Company, Charkop, Kandivali West, Mumbai 400067, MH","+91-22-28676086, +91-22-28602148",",response@vichare.com,",
V K Packwell Pvt Ltd,Companies(Private),Delhi,"I-44-B, Co-operative Estate, Dada Nagar, Kanpur 208025, UP","+91-512-2394949, +91-9839660066",",feedback@vkgroupindia.in,sales2@vkgroupindia.in,sales@vkgroupindia.in,sales@LawyerServices.in,info@LawyerServices.in,",
Universal Delivery Solutions Ltd,Companies(Private),Delhi,"4/5, Chinatamani Co-operative Housing Society, Sambhaji Nagar, Sahar Road, Andheri East, Mumbai 400069, MH",-32982109,"info@udsww.com,u003eDSAS.ASSOCIATES@GMAIL.COM,DSAS.ASSOCIATES@GMAIL.COM,,",
United Liner Agencies of India Pvt Ltd,Companies(Private),Delhi,"801, Godrej Coliseum, C wing, Off Somaiya Hospital Road, Sion East, Mumbai 400022, MH",-61509931,",rajesh.ucha@rediffmail.com,mayanky@unitedliners.com,",
United Business Xpress India Pvt Ltd (UBX),Companies(Private),Delhi,"128/ B-1, Mohammadpur, Bikaji Cama Place, New Delhi 110066, DL",-42099920,",admin.tirupur@ubxpress.in,accounts@ubxpress.in,csd.chennai@ubxpress.in,chennai@ubxpress.in,u003eaccounts@ubxpress.in,",
Unimark International Pvt Ltd (JS Group),Companies(Private),Delhi,"401, Ecospace, Block 3-A, New Town Rajarhat, Kolkata 700156, WB",-40029242,"accounts@jiwan.com,,manojk.adv@gmail.com,anajali@synopsys.com,amandanna@synopsys.com,",
TRP Logistics Pvt Ltd,Companies(Private),Delhi,"135, 2nd Floor, P H Road, Velappanchavadi, Chennai 600077, TN",-26494538,",subodhgupta.53@gmail.com,info@trplogistics.com,",
Trinity International,Companies(Private),Delhi,"1, Kurbanseth Chawl, Next To Sai Baba Mandir, Opposite Ratna Mahal Hotel, Chakala, Andheri East, Mumbai 400059, MH",-9821519831,",tips@tips.edu.in,info_til@yahoo.in,beetal@beetalfinancial.com,",
Transpole Group,Companies(Private),Delhi,"217, Udyog Vihar, Phase I, Sector 20, Gurgaon 122016, HR",-4096133,",vivek.shukla@transpolegroup.net,u003evivek.shukla@transpolegroup.net,",
Transolutions Pvt Ltd,Companies(Private),Delhi,"11098-B, East Park Road, New Delhi 110005, DL","+91-11-23557895, +91-11-23557891",",ritesh@adityacargo.com,gm@vijaylakshmi.com,vltho@rediffmail.com,delhi@transolutions.co.in,opcent@vijaylakshmi.com,",
Transafe Services Ltd,Companies(Private),Delhi,"21, Balmer Lawrie House, 6th Floor, Netaji Subhash Road, Kolkata 700001, WB","+91-33-22424505, +91-33-22424336",",cs@omlogistics.co.in,delhi@transolutions.co.in,pxx@transafeservices.com,u003ecs@omlogistics.co.in,",
Tigers Worldwide Logistics Pvt Ltd,Companies(Private),Delhi,"301, Sangeet Plaza, Marol, Andheri East, Mumbai 400059, MH",-40312931,",csvishal@tigerlogistics.in,india.finance@go2tigers.com,vanessa.manjeshwar@go2tigers.com,john@tigerlogistics.in,delhi@bbcargo.com,",
Synthetic Packers Pvt Ltd,Companies(Private),Delhi,"262/263, Peenya Industrial Area, 4th Phase, Bangalore 560058, KA","+91-80-28394404, +91-80-28395681",",cs@synpack.com,info@synpack.com,shivakumar@icraindia.com,formosa.synthetic@gmail.com,",
Swastik Associates,Companies(Private),Delhi,"7, G Lane, V.V.P Nagar, Thattanchavadi, Pudducherry 605009, TN",-4202453,"admin@swastikinfralogics.com,,x3elist.india@list-group.com,list.india@list-group.com,",
Surakhsha Transport Systems India Pvt Ltd,Companies(Private),Delhi,"113/2, Seerapalayam Road, Bodipalayam, Coimbatore 641105, TN",-2611342,",u003efinance@surakhsha.in,info@surakhsha.in,finance@surakhsha.in,stsl@surakhsha.in,info@companydetails.in,mktg@surakhsha.in,",
Sunrise Movers & Packers,Companies(Private),Delhi,"4, Krishna Lila Market, Vadodara 390022, GJ",-9737973646,,
Sun Diapet,Companies(Private),Delhi,"2/1 & 2, Khokhani Industrial Complex, Sativali, Vasai East, Thane 401208, MH",-3209008,,
Sterling Translogistics Pvt Ltd,Companies(Private),Delhi,"FF-12, 12-A, 14, Parade Plaza, Near Hathijan Cross Road, S P Ring Road, Vinzol, Ahmedabad 382445, GJ",-29295983,",ghai@nde.vsnl.net.in,subesingh@stll.in,",
SSPM Systems & Engineers,Companies(Private),Delhi,"175-178, G.I.D.C, Phase 2, Vatva Industrial Area, Vatva, Ahmedabad 382445, GJ","+91-79-25830464, +91-79-25895128",,
Sravan Shipping Services Pvt Ltd,Companies(Private),Delhi,"47-14-3, Potluri Classic, 4th Floor, Beside SBI Dwarakanagar, Visakhapatnam 520016, AP",-6617822,",commercial@sravanship.com,operations@sravanship.com,operationscfs@sravanship.com,marketing@sravanship.com,bdc@sravanship.com,",
SPP Food Products Pvt Ltd,Companies(Private),Delhi,"10678, Near Shankar Piao, Nabi Karim, Jhandewallan Road, New Delhi 110055, DL",-23522209,"mca@gskassociates.com,u003esppdelhi@hotmail.com,,sppdelhi@hotmail.com,admin@spppolymer.com,",
Spheretech Packaging India Pvt Ltd,Companies(Private),Delhi,"101/102, Swastik Disa Kohinoor, Mill Compound, Opposite Shreyas Cinema, L B S Marg, Ghatkopar West, Mumbai 400086, MH",-25003309,",info@spheretech.biz,accounts@spheretech.biz,span_mkt@rediffmail.com,",
Spareage Seals Ltd,Companies(Private),Delhi,"Oil Seal House, Wagle Industrial Estate, Thane West 400604, NH",-25800903,",sales@spareage.in,abdel@suebel.be,",
SM Couriers Services Pvt Ltd,Companies(Private),Delhi,"5-B, 242, 2nd Floor, Mittal Estate, Marol Naka, Andheri East, Mumbai 400059, MH","+91-22-28592020, +91-22-28592021",",support@smexpresslogistics.com,contactsandhya@hotmail.com,ACCOUNTS@SMCCWORLDWIDE.COM,",
Skyways Air Services Pvt Ltd,Companies(Private),Delhi,"A-128 & 129, National Highway 8, Road No 4, Mahipalpur Extention, New Delhi 110037, DL","+91-11-45150500, +91-11-45150505",",himanshu.chhabra@skyways-group.com,u003ehimanshu.chhabra@skyways-group.com,girishmangla@gmail.com,info@skyways-group.com,",
Skynet Worldwide Express Pvt Ltd,Companies(Private),Delhi,"21, Vasant, 2nd Floor, Above Regency, Prof. N.S. Phadke Marg, Andheri East, Mumbai 400069, MH","+91-22-61986722, +91-22-61986728",",customerservice@skynet.co.za,h_s_saluja@yahoo.com,cs@skynetworldwide.com,x3ecustomerservice@skynet.co.za,u003eskynetexpressindia@gmail.com,skynetexpressindia@gmail.com,",
Silver Pack Industries,Companies(Private),Delhi,"2409/4, Phase IV, G.I.D.C Industrial Estate, Wadhwan, Surendranagar 363035, GJ",-9825223683,,
Shriji Polymers India Ltd,Companies(Private),Delhi,"15-D, Industrial Area, Maxi Road, Ujjain 456001, MP","+91-734-2524071, +91-734-2524073",",omkrishnagrc@gmail.com,accounts@packingpeople.com,jane@shrijipolymers.com,info@shrijipolymers.com,x3eaccounts@packingpeople.com,",
Shree Matangi Woven Sack Pvt Ltd,Companies(Private),Delhi,"28, Gujarat Society, Opposite Indian Red Cross Blood Bank, Ahmedabad 380007, GJ",-22172994,",u003ebhavinvyas1971@yahoo.com,bhavinvyas1971@yahoo.com,",
Shree Anjani Courier Services Pvt Ltd,Companies(Private),Delhi,"34, Shree Anjani House, Near ST Bus Stand, Gita Mandir, Old Lati Bazar, Ahmedabad 380022, GJ","+91-79-25461202, +91-9375450506",",lilabhai1958@yahoo.co.in,",
Scorpion Group,Companies(Private),Delhi,"117-118, T V Industrial Estate, S. K. Ahire Marg, Behind Glaxo, Worli, Mumbai 400030, MH",-24978746,",bm.okhla@scorpiongroup.in,exploreakc@gmail.com,last@scorpiongroup.in,scorpio_tiwari@yahoo.com,",
Sattva CFS & Logistics Pvt Ltd,Companies(Private),Delhi,"82, New No 153, Level 4, Santhome High Road, Raja Annamalaipuram, Chennai 600028, TN",-24612782,,
Sat Kabir Logistics Pvt Ltd,Companies(Private),Delhi,"47/16, Anand Vihar, Bakerwala Marg, Nangaloi, Najafgarh Road, New Delhi 110041, DL",-9311262289,",u003erssuhag@satkabirlogistics.com,rssuhag@satkabirlogistics.com,",
Sarco Roadlines Pvt Ltd,Companies(Private),Delhi,"7, Sarco House, A B Road, Mangal Nagar, Indore 452015, MP","+91-731-4295100, +91-731-4295113",",last@sarcoindia.com,cahemantgoyal@in.com,doej@sarcoindia.com,",
Samarpan Fabricators Pvt Ltd,Companies(Private),Delhi,"A-182/A-183, Wagle Industrial Estate, Road 16-Z, Thane 400604, MH","+91-22-25820373, +91-22-25821842","x3echaddhagroup@sancharnet.in,,chaddhagroup@sancharnet.in,info@companydetails.in,admin@samarpanfab.com,mukesh@samarpanfab.com,u003emukesh@samarpanfab.com,",
Sai Freight Pvt Ltd,Companies(Private),Delhi,"14/16, Vohra House, Surat Street, Dana Bunder, Masjid Bunder, Mumbai 400009, MH","+91-22-42120500, +91-22-42120599",",bhoomi_faridabad@yahoo.co.in,xperts.tax@gmail.com,rajkumarkalra69@gmail.com,",
Safrane Technologies,Companies(Private),Delhi,"7-A/12, Survey No 21, Paschimnagari, Kothrud, Pune 411029, MH",-25435697,",vikram.bhardwaj@safranindia.com,",
Roadwings International Pvt Ltd,Companies(Private),Delhi,"8, Shanti Niketan, 12th Floor, Times Of India Floor, Camac Street, Kolkata 700017, WB","+91-33-22825784, +91-33-22825849","roc.tds@gmail.com,xxxx@roadwingsint.com,,",
RCS Logistics Pvt Ltd,Companies(Private),Delhi,"13, L R Mansion, 4th Floor, Old Airport, Kodihalli, Bangalore 560008, KA",-49127877,"noida@rsclogistics.in,,gslogistics_2006@yahoo.com,tony.ind@rcs-asia.com,x3egslogistics_2006@yahoo.com,",
RCI Logistics Pvt Ltd,Companies(Private),Delhi,"83, Near Railway Crossing, Kompally, Hyderabad 500014, TS","+91-40-23464063, +91-40-23464062",",delhi@rcilogistics.co.in,rcisss@rciindial.com,xxxx@rcindial.com,axxxxxxxxxa@rcilogistics.co.in,",
Ravon India,Companies(Private),Delhi,"5/16, Street No 7, Geeta Colony, New Delhi 110031, DL",-9873740274,"sinha.del@ravenexim.com,,secretarial@advanceindia.co.in,raven@advanceindia.co.in,raven@aipl.com,",
R S Mould Plast India Pvt Ltd,Companies(Private),Delhi,"305-12/2, Chetak Center No, R N T Marg, Indore 452001, MP","+91-731-2528911, +91-731-4070286",",signaturemouldplast@yahoo.com,clifford.pinto@roquette.com,rsmarketing1994@gmail.com,compliance@wamser-batra.in,x3ecompliance@wamser-batra.in,KAUSHAL_AGRAWAL@HOTMAIL.COM,x3eclifford.pinto@roquette.com,",
R D Singal & Co,Companies(Private),Delhi,"A-81/2, Wazirpur Industrial Area, New Delhi 110052, DL","+91-11-27372692, +91-11-27371958",,
Quickli Technologies Pvt Ltd,Companies(Private),Delhi,"1109, JMD Megapolis, Sector 48, Sector 48, Sohna Road, Gurgaon 122018, HR","+91-9711113223, +91-9643200406","x22SANJEEV08G@GMAIL.COM,,bhuvan@lendbox.in,sourav.daga@met-technologies.com,x22bhuvan@lendbox.in,SANJEEV08G@GMAIL.COM,x3eSANJEEV08G@GMAIL.COM,x3ebhuvan@lendbox.in,finance@fizzysoftware.com,x3esourav.daga@met-technologies.com,we@webreinvent.com,sudhanshu@quickli.com,x3erashi@zypp.app,rashi@zypp.app,",
Promens India Pvt Ltd,Companies(Private),Delhi,"601, Venus Atlantic Corporate Park, Anandnagar Road, Prahladnagar, Ahmedabad 380015, GJ",-40073868,",santosh.kumar@promens.com,rahul@moglix.com,pku@leapwork.com,",
Procam Logistics Pvt Ltd,Companies(Private),Delhi,"1303, JMD Regent Square, M G Road, Gurgaon 122002, HR","+91-124-4873300, +91-124-4873315","u003etg.ramalingam@procamlogistics.com,tg.ramalingam@procamlogistics.com,info@procamgroup.in,,",
Pratham Technologies Pvt Ltd,Companies(Private),Delhi,"14, Dhadge Industrial Estate, Near Savli Dhaba, Sinhagad Road, Nanded Phata, Pune 411041, MH","+91-9921009976, +91-9921009974",",gabrieladebiyi@gmail.com,info@pratham.org,n.infratech@gmail.com,accounts.vegas@yahoo.in,finance@prathamtech.com,prathamkohliofficial@gmail.com,u003efinance@prathamtech.com,",
Prakash Parcel Services Ltd,Companies(Private),Delhi,"18/3, 1st Main, Mission Road, Bangalore 560027, KA",-22124211,",info@pps.in,jxxxxxxp@pps.in,Noida@pps.in,id-dpsharma@pps.in,",
Prakash Freight Movers Ltd,Companies(Private),Delhi,"C-130, 1st Floor, Naraina Industrial Area, Phase 1, New Delhi 110028, DL",-42228142,",accounts@pfmlindia.com,u003eaccounts@pfmlindia.com,",
Prakash Enterprises,Companies(Private),Delhi,"A-86, Shahbad, Daulatpur, New Delhi 110042, DL",-27898580,"u003eparkash.enterprises@rediffmail.com,,x3eakhil.gupta@kanta-group.com,parkash.infrastructurelimited@gmail.com,parkash.enterprises@rediffmail.com,akhil.gupta@kanta-group.com,",
Pragati Plastics Pvt Ltd,Companies(Private),Delhi,"15, Aradhana, Sector 13, R K Puram, New Delhi 110066, DL","+91-11-24671402, +91-11-24674739","delhi_+919810189320_91-11-26110361_www.pragatiplastics.com_info@pragatiplastics.com,info@pragatiplastics.com,,",
Pearl Packaging,Companies(Private),Delhi,"652/1, Sir C V Raman Industrial Estate, Coimbatore 641021, TN","+91-422-2676385, +91-422-6529795","mail@pearlpackaging.com,,sales@pearlpackaging.com,last@pearlpet.net,",
Patna Freight Movers,Companies(Private),Delhi,"Anisabad Bye Pass Road, Patna 800002, BR",-9973937953,",info@drsindia.com,",
Parekh Aluminex Ltd,Companies(Private),Delhi,"G-11, Everest Building, 8th Floor, Tardeo, Mumbai 400034, MH","+91-22-23521777, +91-22-23522777",",swati.agrawal@careratings.com,parekhcs@rocketmail.com,",
Param Packaging Pvt Ltd,Companies(Private),Delhi,"12/4, Piramal Industrial Estate, S V Road, Piramal Nagar, Goregaon West, Mumbai 400062, MH","+91-22-28743069, +91-22-42631300",",info@parampackaging.com,",
Pannest Integrated Services Pvt Ltd,Companies(Private),Delhi,"3/A-1, Sona Udyog, Parsipanchayat Road, Andheri East, Mumbai 400069, MH","+91-9833380332, +91-22-67252226",",xxxx@pannest.com,",
Paam Commercial Pvt Ltd,Companies(Private),Delhi,"5-3-488, Old Topkhana Road, Osmangunj, Hyderabad 500012, TS","+91-40-24615104, +91-40-24615182",",info@paamgroup.com,legaldept21@gmail.com,PAAMEATABLESLTD@GMAIL.COM,hr@paamgroup.com,akdas13@gmail.com,",
P. V. Cargo Carriers Pvt Ltd,Companies(Private),Delhi,"515, B-6, Ansal Chamber, Bhikaiji Cama Place, New Delhi 110066, DL","+91-11-26170190, +91-11-26188823","praveen@pvgroupindia.com,,pvagency@vsnl.net,u003epraveen@pvgroupindia.com,",
P S Atree & Co. Pvt Ltd,Companies(Private),Delhi,"B-46, Kalkaji, New Delhi 110019, DL","+91-11-26443485, +91-11-26451078",,
P M Relocations Pvt Ltd,Companies(Private),Delhi,"61, Sector 18, Gurgaon 122015, HR",-4551433,",last@pmrelocations.com,u003eacctsmgr@pmrelocations.co.in,acctsmgr@pmrelocations.co.in,info@pmrelocations.com,",
P G Foils Ltd,Companies(Private),Delhi,"Pipalia Kalan, Raipurraj 306307, RJ","+91-2937-287151, +91-2937-287155","pgfoils.investor@gmail.com,,pgfoils@pgfoils.in,last@pgfoils.com,",
Oxford Express Pvt Ltd,Companies(Private),Delhi,"72/B-9, Lakshmi Bhawan, Nehru Palace, New Delhi 110019, DL","+91-11-26443452, +91-11-41606841",",oxford_express@yahoo.co.in,u003eoxford_express@yahoo.co.in,",
Overseas Logistics Pvt Ltd,Companies(Private),Delhi,"LG-9 & 10, 15, Somdatt Chambers, Bhikaji Cama Place, New Delhi 110066, DL",-47244364,"manoj.gupta@overseaslogistic.com,,info@overseaslogistic.com,",
Overseas Courier Services India Pvt Ltd,Companies(Private),Delhi,"11, 3rd Floor, IGI Airport, New Delhi 110037, DL",-44555586,",hr@ocs-india.com,indu.actsocsdel@ocs-india.com,",
Opal Asia Logistics (India) Pvt Ltd,Companies(Private),Delhi,"201/204, Sabari Samriddhi, Sion Trombay Road, Chembur East, Mumbai 400071, MH",-66808031,",delhi@bbcargo.com,jane_doe@opalasia.com,info@companydetails.in,",
Omori India Pvt Ltd,Companies(Private),Delhi,"Neptune Towers, 9th Floor, BPC Road, Alkapuri, Vadodara 390005, GJ",-6626076,",hr@omori.co.in,om@shinecargo.com,customercare@omori.co.in,spares@omori.co.in,mktg@omori.co.in,",
Omniplast Pvt Ltd,Companies(Private),Delhi,"2, Road No 2, Mundka Udyog Vihar, New Delhi 110041, DL",-9953356816,"omniplast@omniplast.org,,u003eCATARUNG0912@GMAIL.COM,CATARUNG0912@GMAIL.COM,",
Omdeo Packers & Movers Pvt Ltd,Companies(Private),Delhi,"G-80, Gupta Complex, Laxmi Nagar, New Delhi 110092, DL","+91-11-32600969, +91-9312109046",,
Om Trans Logistics Ltd (OM),Companies(Private),Delhi,"159, Punjabi Bagh, T C Ring Road, New Delhi 110035, DL",-28316461,",info@omtrans.in,omgroup@omlogistics.co,financedel@omtrans.in,IN_-_accdel@omtrans.in,x3eomgroup@omlogistics.co.in,omgroup@omlogistics.co.in,accdel@omtrans.in,",
Om Packaging,Companies(Private),Delhi,"1239, HSIIDC Industrial Area, Rai District, Sonipat 131028, HR","+91-130-2367601, +91-130-2367602",",ncr@ncraj.com,",
Om International Courier & Cargo,Companies(Private),Delhi,"4, Vakratund Co-operative Housing Society, A Wing, Near HDIL Building, S.N. Marg, Sambhaji Nagar, Andheri East, Mumbai 400069, MH",-32460521,,
North Sea Shipping And Logistics Pvt Ltd,Companies(Private),Delhi,"52, Chandan Niketan, 4th Floor, Shakespeare Sarani, Kolkata 700017, WB","+91-33-22890832, +91-33-22890856",",delhi@bbcargo.com,customercare@northseashipping.com,bijan@northseashipping.com,",
New Pack Plastics Pvt Ltd,Companies(Private),Delhi,"D-25, Sector 11, Noida 201301, UP","+91-120-2527914, +91-120-2533249","doe.jane@newpackplastics.com,,vistasbg@gmail.com,RAMESHRAJATANDCOMPANY@YAHOO.CO.IN,veekay12@satyam.net.in,info@newpack.in,u003eRAMESHRAJATANDCOMPANY@YAHOO.CO.IN,",
NavaGen Products Pvt Ltd,Companies(Private),Delhi,"713, Old Syndicate Bank Road, 1st Stage, Indiranagar, Bangalore 560038, KA","+91-80-25274495, +91-80-25274496","mail@navagenindia.com,,thankachan.thomas@navagenindia.com,",
Nagpal Packaging Machinery Pvt Ltd,Companies(Private),Delhi,"B-7, Opposite To JCB India Limited, Sector 59, Phase II, Mathura Road, Ballabgarh, Faridabad 121004, HR","+91-129-4067600, +91-129-2307700",",u003enagpalpackaging@gmail.com,nagpalpackaging@gmail.com,accounts@npmmachinery.com,x3eaccounts@npmmachinery.com,x3ekssarnaik@prasannapackaging.com,natrajindustries1978@gmail.com,kssarnaik@prasannapackaging.com,",
Mphinite Solutions Pvt Ltd,Companies(Private),Delhi,"60-E, Bommasandra Industrial Area, Bangalore 560099, KA",-43436189,",tax@manjushreeventures.com,",
Modern Packaging Company,Companies(Private),Delhi,"Jitendra Industrial Estate, 2nd Floor, Chakala, Andheri East, Mumbai 400093, MH",-67209232,",last@modpkg.com,d-jane@modpkg.com,mppl2005@yahoo.co.in,info@jupiterlaminators.com,",
Minerva Packaging Corporation,Companies(Private),Delhi,"7-C, Middleton Street, Kolkata 700071, WB","+91-33-28650327, +91-9830054725",",choprarohit24@gmail.com,deepak@bengani.com,",
Mewar Polytex Ltd,Companies(Private),Delhi,"207-A, Mewar Industrial Area, Road No 11, Madri, Udaipur 313003, RJ","+91-294-2491036, +91-294-2491736",",priti.agarwal@careratings.com,x3eshareholders@mewarpolytex.com,mewar@mewarpolytex.com,shareholders@mewarpolytex.com,",
Mehtani Flexipack Pvt Ltd,Companies(Private),Delhi,"139, GEB Power Station, Near L & T, Sarkhej Bavla Highway, Sanand 382213, GJ","+91-2717-645572, +91-8447523341",",kapilmehtani@gmail.com,",
Megaflex Plastics Ltd,Companies(Private),Delhi,"14/1-C, Suite 4-B, 4th Floor, Jaimunddin Mistry Lane, Kolkata 700071, WB","+91-33-22827405, +91-33-22827408","saransh.jain@hindustantimes.com,,sanjay@megaflex.in,",
Mars Synergies Pvt Ltd,Companies(Private),Delhi,"14-C, 8/9/10, Groma House, 9th Floor, C Wing, Sector 19, Vashi, Navi Mumbai 400703, MH",-64504718,,
Maris Associates Pvt Ltd,Companies(Private),Delhi,"168, North Cotton Road, Tuticorin 628001, TN","+91-461-2326709, +91-461-2326809",",info@marisfibc.com,",
Machines Boucherie India Pvt Ltd,Companies(Private),Delhi,"2-C/902, Behind Maxwell Public School, Kalyan Nagar, Banaswadi, Bengaluru 560043, KA",-25427255,",info@boucherieindia.com,u003einfo@boucherieindia.com,info@brushexpert.com,",
M. R. Shah Logistics Pvt Ltd,Companies(Private),Delhi,"355, Sector 12-B, Tagore Road, Gandhidham 370201, GJ",-237485,"u003emrst@mrshahgroup.com,,mrst@mrshahgroup.com,chaitaly@ekfpl.com,",
LTC Logistics Pvt Ltd,Companies(Private),Delhi,"275, Transport Nagar, Sector 58, Ballabgarh, Faridabad 121004, HR","+91-129-4020331, +91-129-2430263",",rrafbd12@gmail.com,matta.ankush@ltclogistics.in,",
Leadking Air Services Pvt Ltd,Companies(Private),Delhi,"Pragati Towers, 4th Floor, Linghi Chetty Street, Chennai 600001, TN","+91-44-25230504, +91-44-25229775",",info@sagroupindia.com,info@leadking.in,",
