Name,Sector,City,Address,Phone,Email,Lat-Long
Colinz Laboratories Ltd,Companies(Private),Delhi,"A/101, Pratik Estate, Near fortis Hospital, Mulund Link Road, Mulund, Mumbai 400078, MH",,",Colinzlabs@yahoo.com,colinzlabs@yahoo.com,",
Celogen Pharma Pvt Ltd,Companies(Private),Delhi,"B-106, Techno City, TTC Industrial Area, MIDC, Mahape, Navi Mumbai 400705, MH",,",info@celogenpharma.com,x3en.vijay@celogenpharma.com,u003ddistressdebtandasset@gmail.com,n.vijay@celogenpharma.com,",
Cedna Biotech Pvt Ltd,Companies(Private),Delhi,"E-22, B-1, Mohan Co-operative Industrial Estate, Mathura Road, New Delhi 110044, DL",,",md.cmg@cmgbiotech.in,info@cednabiotech.com,cednabiotech@gmail.com,x3emd.cmg@cmgbiotech.in,",
Cachet Pharmaceuticals Pvt Ltd,Companies(Private),Delhi,"415, Shah Nahar Industrial Estate, Dr. E Moses Road, Worli Naka, Mumbai 400018, MH",,",pranay.nandgaonkar@cachetindia.com,info@companydetails.in,x3epranay.nandgaonkar@cachetindia.com,Hrd@cachetindia.com,",
Bioved Pharmaceuticals Pvt Ltd,Companies(Private),Delhi,"5-6/12, Vadgaon, Khurd, Pune 411041, MH",,",x3enrpharmaceutical@gmail.com,nrpharmaceutical@gmail.com,info@companydetails.in,bvpindia@bioved.com,x3ebvpindia@bioved.com,",
Bharat Serums and Vaccines Ltd,Companies(Private),Delhi,"K-10, Liberty Tower, 3rd Floor, Behind Reliable Tower, Airoli, Navi Mumbai 400708, MH",,",last@bharatserums.com,",
Baroque Pharmaceuticals Pvt Ltd,Companies(Private),Delhi,"192/2 & 3, Sokhada, Khambat 388620, GJ",,",bjt_asso@yahoo.co.in,inquiry@baroquepharma.com,x22account@baroquepharma.com,account@baroquepharma.com,x3eaccount@baroquepharma.com,it@baroquepharma.com,first@baroquepharma.com,",
Bacil Pharma Ltd,Companies(Private),Delhi,"71, Laxmi Building, Sir, PM Road, Fort, Mumbai 400001, MH",,",basilpha@yahoo.com,info@bacilpharma.com,saransh.jain@hindustantimes.com,x3ebasilpha@yahoo.com,",
Babuline Pharma Pvt Ltd,Companies(Private),Delhi,"237/406, Gulab Building, 4th Floor, Near GPO, P D' Mello Road, Fort, Mumbai 400001, MH",,",doe-jane@babuline.net,babuline@babuline.com,",
Auro Laboratories Ltd,Companies(Private),Delhi,"314, T V Industrial Estate, S K Ahire Marg, Worli, Mumbai 400030, MH",,",Auro@aurolabs.com,auro@aurolabs.com,",
Astellas Pharma India Pvt Ltd,Companies(Private),Delhi,"301/127, C & B Square, 3rd Floor, Andheri Kurla Road, Chakala, Andheri East, Mumbai 400069, MH",,",jane.doe@astellas.com,gxx@astellas.com,x3ejane.doe@astellas.com,Aid_finance@astellas.com,last@astellas.com,",
Ashish Life Science Pvt Ltd,Companies(Private),Delhi,"213, Laxmi Plaza, Laxmi Industrial Estate, New Link Road, Andheri West, Mumbai 400053, MH",,",last@ashishlifescience.com,",
Ascent Pharma,Companies(Private),Delhi,"163/9, Near Chintan Gas Godown, SIDC Road, Veraval, Kotada Sangani 360001, GJ",,"nimeshrungta@gmail.com,,ascentpharma123@gmail.com,first@ascentmeditech.com,x3einfoindia@actavis.com,ascentpharma100@yahoo.co.in,info@ascentpharm.com,contact@ascentpharma.in,",
Archerchem,Companies(Private),Delhi,"802, Advent Atria, Opposite Kingstone, Chincholi Bunder Road, Malad West, Mumbai 400064, MH",,",info@archerchem.com,anmol1801@gmail.com,",
Applied Nutrition Sciences,Companies(Private),Delhi,"43, Sigma House, R A Kidwai Marg, Wadala, Mumbai 400031, MH",,",admissions@manavrachna.edu.in,info@niftem.ac.in,",
Anjan Drug Pvt Ltd,Companies(Private),Delhi,"117, Nelson Tower, 5th Floor, Wing 2, Nelson Manikam Road, Aminjikarai, Chennai 600029, TN",,",info@anjandrug.net,last_initial@anjandrug.net,",
Animate Pharma,Companies(Private),Delhi,"WZ 46/4-A, Mukherjee Park Extension, New Delhi 110018, DL",,",advt.shiva@gmail.comUnnamed,n@gmail.com,",
Ambrosia Remedies Pvt Ltd,Companies(Private),Delhi,"Shreeji Krupa?, 1st Floor, Baxi's Paga, Near Navrang Complex, Raopura, Vadodara 390001, GJ",,",u003eambrosiarem@gmail.com,arpl301@gmail.com,ambrosiarem@gmail.com,smprofessional588@gmail.com,",
Alpa Laboratories Ltd,Companies(Private),Delhi,"33/2, Pigdamber, A B Road, Rau, Indore 453446, MP",,",is@alpalabs.in,x3eshailesh.singh@galpha.com,pradeep.kumar@careratings.com,hr@alpalabs.in,mail@alpalabs.in,mktg@alpalabs.in,is@alpalabs.comat,ipo@alpalabs.com,x3ecs@alpalabs.in,",
Allied Trading Corporation,Companies(Private),Delhi,"1297, Farash Khana Main Road, New Delhi 110006, DL",,",niweshbansal@yahoo.co.in,vikashbansalhm@gmail.com,",
Alice Pharma Pvt Ltd,Companies(Private),Delhi,"A-302, Everest Nivara Infotech Park, MIDC Main Road, Indira Nagar, Turbhe, Navi Mumbai 400705, MH",,",x3eexport@alicepharma.co.in,alicepharmaindia@gmail.com,x3eeppl@live.in,que_ad1@yahoo.co.in,info@alicepharma.co.in,x3einfo@alicepharma.co.in,export@alicepharma.co.in,alicehealthcarepvtltd@gmail.com,alicepharma@hotmail.com,x3eque_ad1@yahoo.co.in,eppl@live.in,",
Alcon Biosciences Pvt Ltd,Companies(Private),Delhi,"114/11, Marine Chambers, New Marine Lines, Mumbai 400020, MH",,",finance@euresian.com,finance3@spentose.com,info@companydetails.in,sunil.vasanth@alcon.com,customercare.india@alcon.com,x3efinance@euresian.com,x3esunil.vasanth@alcon.com,",
Alarsin,Companies(Private),Delhi,"A/32, Alarsin House, Street No 3, MIDC, Andheri East, Mumbai 400093, MH",,",info@alarsin.in,alarsinmumbai@gmail.com,",
Akumentis Healthcare Ltd,Companies(Private),Delhi,"504, G Corp Tech Park, 5th Floor, Near Hypercity, Ghodbunder Road, Kasarvadavali, Thane West 400615, MH",,",x3ecs@akums.net,24x7@myakumentis.com,rxxxxxxxxxxn@akumentishealthcare.com,cs@akums.net,",
AIOCD Pharmasofttech AWACS Pvt Ltd,Companies(Private),Delhi,"54, 2nd Floor, L B Road, Adyar, Chennai 600020, TN",,",contact@aiocdawacs.com,u003ejagannath.shinde@aiocd.com,info@companydetails.in,jagannath.shinde@aiocd.com,first@aiocdawacs.com,",
Agron Remedies Pvt Ltd,Companies(Private),Delhi,"Opposite New Anaaj Mandi, Moradabad Road, Kashipur 244713, UK",,",agronremedies@rediffmail.com,kamaljhawar@rediffmail.com,u003eagronremedies@rediffmail.com,",
Advinus Therapeutics Ltd (Tata),Companies(Private),Delhi,"21 & 22, Peenya Industrial Area, Phase 2, Next To NTTF, Peenya, Bengaluru 560058, KA",,"bipin.khale@acclimited.com,,purchase@ab-tech.in,",
Accent Microcell Pvt Ltd,Companies(Private),Delhi,"314, Shangrilla Arcade, Shyamal Cross Roads, Anandnagar Road, Satellite, Ahmedabad 380015, GJ",,",einward.ris@kfintech.com,last@accentmicrocell.com,x3ehrd@accentmicrocell.com,info@accentmicrocell.com,hrd@accentmicrocell.com,",
Abbott Healthcare Pvt Ltd,Companies(Private),Delhi,"A-201, Everest Grande, Opposite Ahura Centre, Mahakali Caves Road, Andheri East, Mumbai 400093, MH",,",x3ejane.doe@abbott.com,websmaster@abbott.co.in,durgesh.paliwal@abbott.com,Nandini.goswami@abbott.com,investorrelations.india@abbott.com,jane.doe@abbott.com,x3edurgesh.paliwal@abbott.com,",
Zydus Animal Health (Zydus),Companies(Private),Delhi,"Astron Tech Park, 5th Floor, Satellite Cross Roads, Ahmedabad 380015, GJ","+91-79-26868681, +91-79-26868100","x3eupen.shah@zyduscadila.com,,upen.shah@zyduscadila.com,",
Zuari Seeds Ltd (Adventz),Companies(Private),Delhi,"A-148, Level 1, 2nd Floor, Krishnamma House, Road No 7, Banjara Hills, Hyderabad 560034, TS",+91-40-23390184,",ig.zgl@adventz.com,wecare@adventz.zuarimoney.com,x3eshares@adventz.com,sanjitmohapatra@adventz.com,",
Yaseen Mowlana Factory,Companies(Private),Delhi,"Natham Road, Nallampatti, Dindigul 624003, TN","+91-451-2470623, +91-9842178622",",nupurcarpets.delhi@gmail.com,ZFayaz@STC.in,alamalenterprises.delhi@gmail.co,ymfneemindia@gmail.com,faurizexports@gmail.com,",
WOW Food Brands Pvt Ltd,Companies(Private),Delhi,"601/602, Kamala City, Trade World Building, B Wing, Senapati Bapat Marg, Lower Parel West, Mumbai 400013, MH",+91-22-67812000,",lcyadav1@yahoo.com,neha.goyal@agsindia.com,9mwowfoods.sales@gmail.com,",
Wintech Taparia Ltd,Companies(Private),Delhi,"Film Bhawan, 1st Floor, 60-B, Ahilyamada Colony, Near Rani Sati Gate, Y N Road, Indore 452003, MP","+91-731-2523950, +91-731-4065690","sales@wintechtaparia.com,info@wintechtaparia.com,,",
WIMWI Foods Pvt Ltd,Companies(Private),Delhi,"Idea Pad Room, CIIE Building, I I M, Vastrapur, Ahmedabad 380015, GJ",+91-9586954738,",x3eviren@deepkiran.co.in,viren@deepkiran.co.in,contact.us@wimwifoods.com,",
VSA Foods & Beverages Pvt Ltd,Companies(Private),Delhi,"224, Market Yard, Gultekdi, Pune 411037, MH",+91-20-65005555,,
VNR Seeds Pvt Ltd,Companies(Private),Delhi,"Ratnagiri Arcade, Near Kalda Nursing Home, G. E Road, Raipur 492001, CG",+91-771-4350005,,
Virgo Industries,Companies(Private),Delhi,"Veliyechal, Kothamangalam, Thattekkad, Muvattupuzha 686681, KL","+91-485-2571106, +91-9048365013",",KAJALV595@gmail.com,",
Vinoth Distributors,Companies(Private),Delhi,"New No 37, Old No 75, Thirupalli Sreet, Sowcarpet, Chennai 600079, TN",+91-44-42049082,",vinodpublications@gmail.com,",
Victus Laboratories India Pvt Ltd,Companies(Private),Delhi,"1st Floor, 395-A, Nanjudapuram Road, Ramanathapuram, Coimbatore 641045, TN",+91-422-4391916,",caankit157@gmail.com,updeshkumar@rediffmail.com,bmvictus@gmail.com,doejane@victuslabs.com,",
Victory Flour Mills,Companies(Private),Delhi,"RZ-2, Rao Harnath Marg, Kapashera, New Delhi 110037, DL",+91-9873088755,",help@rajdhanigroup.com,x3echetan.jain@rajdhanibesan.com,chetan.jain@rajdhanibesan.com,cstarachand@gmail.com,",
Vicco Laboratories,Companies(Private),Delhi,"78, Farmland, Ramdas Peth, Nagpur 440010, MH","+91-712-2420890, +91-712-2420899",",mumbaiaccounts@viccolabs.com,jane@viccolabs.com,saransh.jain@hindustantimes.com,x3emumbaiaccounts@viccolabs.com,consumercare@viccolabs.com,",
VI John Group,Companies(Private),Delhi,"G-59, Mezzianine Floor, Marina Arcade, Middle Circle CP, Behind Hotel Marina, New Delhi 110001, DL",+91-11-47455555,",finance.kochargroup@gmail.com,customercare@vijohngroup.com,hkbatraassociates@rediffmail.com,",
Vegit Merino (Merino Group) (Merino),Companies(Private),Delhi,"5, 60/1, Alexandra Court, Chowringhee Road, Kolkata 700020, WB","+91-33-22879291, +91-33-22877587",",balaji@merinoindia.com,merinodelhi@merinoindia.com,x3ebalaji@merinoindia.com,",
Veer Group,Companies(Private),Delhi,"Near Sajan Party Plot, Sola Road, Ahmedabad 380013, GJ","+91-79-27451451, +91-79-27470197",",veerservices65@gmail.com,veercards@hotmail.com,adamyag@gmail.com,sxxxxxxv@veergroups.com,veer.supreme@gmail.com,paradiseharinagar@gmail.com,",
Varun Agro Processing Foods Pvt Ltd,Companies(Private),Delhi,"Capital Hill, Gat No 181, Umrale Bk, Nashik 422003, MH","+91-253-2533868, +91-253-226315",",u003econtactus@varunagro.com,md@varunagro.com,contactus@varunagro.com,info@infomerics.com,",
Vaishno Devi Dairy Products Pvt Ltd (Shubhi),Companies(Private),Delhi,"G-95 & 96, 3rd Floor, K. K. Market, Pune-Satara Road, Pune 411043, MH","+91-20-24364601, +91-20-40501210","x3egayatridairy2005@yahoo.co.in,gayatridairy2005@yahoo.co.in,contact@vaishnodevidairy.com,,",
Universal Group.,Companies(Private),Delhi,"hub town solaris 306 near east west flyover, Nand Patkar Road, andheri east, Mumbai Maharashtra, 400069",+91-22-61164444,"last@universalgroup.org,,info@uclindia.com,first@universalgroupindia.com,rocuniversalcorp@gmail.com,",
United Breweries Holdings Ltd (UB),Companies(Private),Delhi,"UB Tower, 24, Vittal Mallya Road, Bangalore 560001, KA","+91-80-39856000, +91-80-39856500",",gri@ubmail.com,x3egri@ubmail.com,Ublinvestor@ubmail.com,irg@integratedindia.in,ubhlinvestor@ubmail.com,",
Unique Organics Ltd,Companies(Private),Delhi,"O-407, Calgiri Road, Arihant Plaza, Malviya Nagar, Jaipur 302017, RJ",+91-141-2521804,"x3eheenal.shah@amoliindia.com,,heenal.shah@amoliindia.com,saransh.jain@hindustantimes.com,exports@uniqueorganics.com,unique@uniqueorganics.com,",
Under The Mango Tree Naturals and Organics Pvt Ltd,Companies(Private),Delhi,"A-412, Byculla Service Industries CS, Dadoji Kondeo Cross Marg, Byculla, Mumbai 400027, MH","+91-22-65157953, +91-22-23753110",",u003evijaya@underthemangotree.org,x3ejeetchemorganics@gmail.com,x3evkraut@keshavaindia.com,contact@naturessoulshop.com,vpastala@gmail.com,vijaya@underthemangotree.org,vkraut@keshavaindia.com,jeetchemorganics@gmail.com,customersupport@utmt.in,",
Twinings Pvt Ltd,Companies(Private),Delhi,"C-062C, 6th Floor, Supermart-1, DLF Phase IV, Gurgaon 122002, HR",+91-124-4189500,",vinay.agrawal@twinings.com,",
Tulasi Group,Companies(Private),Delhi,"6-4-6, Arundelpet 4/5, Guntur 522001, AP","+91-863-2224947, +91-863-2223254",",tulasirehab@gmail.com,SUPERHILLASSOCIATES@YAHOO.COM,pasassociates@yahoo.com,hpbainsla@gmail.com,crazy_piyush15@gmail.com,",
Tula Digital India Pvt Ltd,Companies(Private),Delhi,"12-A, Naraina Industrial Area, Phase 1, New Delhi 110028, DL",+91-11-9811020244,"TULADIGI@GMAIL.COM,,Tuladigi@gmail.com,u003eTULADIGI@GMAIL.COM,info@tuladigital.com,",
The Maharashtra Agro Industries Development Corporation Ltd (MAIDC),Companies(Private),Delhi,"Krishi Udyog Bhavan, Dinkar Rao Desai Marg, Aarey Milk Colony, Goregaon East, Mumbai 400025, MH","+91-22-28719301, +91-22-24300823",,
The Kerala Cooperative Milk Marketing Federation Ltd (Milma),Companies(Private),Delhi,"Milma Bhavan, Pattom Palace, Thiruvananthapuram 695004, KL","+91-471-2555981, +91-471-2555993",",milma@milma.com,projects@milma.com,cfp@milma.com,",
The Haryana State Cooperative Supply & Marketing Federation Ltd (HAFED),Companies(Private),Delhi,"Sector 5, Panchkula 134115, HR","+91-172-2590520, +91-172-2590526","rcsharyanaa@yahoo.com,,x3ercsharyanaa@yahoo.com,",
The Designo International,Companies(Private),Delhi,"30-B, Ua Jawahar Nagar, Kamla Nagar, New Delhi 110007, DL",+91-11-23852435,",info@designointernational.com,",
Syno Pack India,Companies(Private),Delhi,"Plot No 39-4/4, Sanjay Gandhi Nagar, Hyderabad 500037, TS",+91-40-23087112,",synopackindia@gmail.com,info@entrepreneurindia.co,npcs.ei@gmail.com,synopackindia@yahoo.co.in,",
SVM Wrappings Pvt Ltd,Companies(Private),Delhi,"28, Blue Rose Industrial Estate, Western Express Highway, Borivali East, Mumbai 400066, MH",+91-22-28546281,",info@svmwrappings.com,",
Suruchi Spices Pvt Ltd,Companies(Private),Delhi,"55/1, Near Umiya Industrial Estate, Octroi Naka, Bhandara Road, Kapsi Khurd, Kamptee, Nagpur 441104, MH",+91-7109-278378,",ravi.jain@suruchispices.net,export@suruchispices.net,",
Suri Agro Fresh Pvt Ltd,Companies(Private),Delhi,"C-129, N. S. M Azadpur, New Delhi 110003, DL","+91-11-27673563, +91-11-27675562",",last@suriagrofresh.com,cs@suriagrofresh.com,info@suriagrofresh.com,u003ecs@suriagrofresh.com,kompal.sharma@suriagrofresh.com,",
Supermax Personal Care Pvt Ltd,Companies(Private),Delhi,"Wagle Industrial Estate, M. Sunderji Road, Thane 400604, MH",+91-22-40451000,"abhinav.mishra@supermaxworld.com,,x3eabhinav.mishra@supermaxworld.com,",
Superior Agro Crops Pvt Ltd,Companies(Private),Delhi,"C 35/6, Lawrence Road, Industrial Area, New Delhi 110035, DL",+91-11-40222111,",rssharmaca@gmail.com,",
Sunstar Overseas Ltd,Companies(Private),Delhi,"40 KM Stone, G. T Karnal Road, Bahalgarh, Sonepat 131021, HR","+91-130-33663355, +91-130-3051100",",last@sunstaroverseas.com,sunstar@del.vsnl.net.in,info@sunstarmail.com,email.sunstar@gmail.com,",
Sunripe Agro Products Ltd,Companies(Private),Delhi,"103, Arihant Ashoka, 1-10-11, Street No 4, Ashok Nagar, Hyderabad 500020, TS","+91-40-27637232, +91-40-27637142","sjonnada02@yahoo.com,,office@smvarmaandco.org,",
Sunil Agro Foods Ltd,Companies(Private),Delhi,"1/104, Ahuja Chambers, Kumara Krupa Road, Bangalore 560001, KA",+91-80-22251555,"manager@sunilagro.in,,saransh.jain@hindustantimes.com,info@sunilagro.in,",
Sungold Tropic Fruit Products Pvt Ltd,Companies(Private),Delhi,"526, 16th Cross, Indiranagar 2nd Stage, Bangalore 560038, KA",+91-80-42152097,",skcs74@yahoo.com,info@companydetails.in,u003eabhishek.sashidharan@gmail.com,abhishek.sashidharan@gmail.com,vivek@icraindia.com,",
Sumeru Beverages Pvt Ltd,Companies(Private),Delhi,"35/1, Gokul Nagar, Katraj Kondhwa Road, Pune 411046, MH","+91-20-26962129, +91-20-26962149",",neeraj@hectorbeverages.com,mehtasunil.2003@gmail.com,x3eneeraj@hectorbeverages.com,x22neeraj@hectorbeverages.com,info@companydetails.in,doe-j@sumerubeverages.com,x3egurjit@kbl.net.in,gurjit@kbl.net.in,sumerubpl@gmail.com,u003esumerubpl@gmail.com,",
Sugoki Namkin and Foods Pvt Ltd,Companies(Private),Delhi,"A. H. 46, Gat No 148/2/B, Paldhi, Dharangaon, Jalgaon, Erandul 425103, MH",+91-2588-255555,"sachinkasat@ymail.com,,",
Stern Ingredients India Pvt Ltd,Companies(Private),Delhi,"211, Nimbus Centre, Off Link Road, Andheri West, Mumbai 400053, MH",+91-22-40275555,",bdp@palanigroup.net,info@companydetails.in,",
SSMP Industries Ltd,Companies(Private),Delhi,"A-128, Sector 63, Noida 201301, UP",+91-120-2427135,",cirpssmp@gmail.com,u003ecirpssmp@gmail.com,hr@ssmpindustries.com,sales@LawyerServices.in,info@LawyerServices.in,",
SR Marine Foods Pvt Ltd,Companies(Private),Delhi,"10/21, First Main Road, Shenoy Nagar West, Chennai 600029, TN","+91-44-42182700, +91-44-42182711",",u003esushil@thesrgroup.in,bssefd@vsnl.net,sushil@thesrgroup.in,",
Spac Starch Products India Ltd,Companies(Private),Delhi,"140, Perundurai Road, Erode 638011, TN","+91-4256-257901, +91-424-2550555",",info@spacstarch.com,venkat@spacstarch.com,info@companydetails.in,xxxxx@gmail.com,",
South Indian Green Cardamom Company Ltd,Companies(Private),Delhi,"XVII/225-228, Vechoorattu Building, Vandanmedu, Nedumgandam 685551, KL",+91-4868-228585,",sigclvdu@gmail.com,sigcclvdu@gmail.com,u003esigclvdu@gmail.com,",
Snap Marketing Pvt Ltd,Companies(Private),Delhi,"322/16, Hotel Seven Loves Chowk, Behind Indian Oil Petrol Pump, Shankershet Road, Pune 411030, MH",+91-20-26433140,",accounts@snapmktg.com,u003eaccounts@snapmktg.com,",
Sirius Overseas Pvt Ltd,Companies(Private),Delhi,"Valutimmapuram Road, Kakinada 533437, AP",+91-884-2326600,",tax@pattabhiagro.com,info@companydetails.in,",
Siddhi Margarine Specialities Ltd,Companies(Private),Delhi,"Survey No 240, Behind Bhagyodaya Hotel, Sarkhej-Bawla Highway, Changodar 382210, GJ","+91-2717-650255, +91-2717-250110",",roc@caagupta.com,",
Shrinathji Agro Food Industries Pvt Ltd,Companies(Private),Delhi,"A/154, Laxmi Cottage, Dr. Ambedkar Road, Parel, Mumbai 400012, MH",+91-22-24702454,",haresh_sanghvi@rediffmail.com,malathi@shrinathjiagro.com,u003emalathi@shrinathjiagro.com,sntc2639@gmail.com,",
Shri Chamundi Baking Equipments,Companies(Private),Delhi,"Door No 252, Perumal Kovil Street, Annalagraharam, Sakkottai, Kumbakonam 612401, TN","+91-435-2432394, +91-435-2421081",",info@royalbengal.in,shegde21@gmail.com,",
Shree Renuka Sugars Ltd,Companies(Private),Delhi,"BC-105, Havelock Road, Camp, Belgaum 590001, KA","+91-831-2404000, +91-831-2404961",",investor@renukasugars.com,groupcs@renukasugars.com,last@renukasugars.com,exportsenquiry@renukasugars.com,",
Shiv Shakti Agro India Ltd,Companies(Private),Delhi,"7, Chitrkoot Building, 7th Floor, Room No 78 & 79, 230-A, A. J. C Bose Road, Kolkata 700020, WB","+91-33-22817846, +91-33-22817847",",info@shivshaktiagro.com,",
"Shervani Industrial Syndicate Ltd , Allahabad",Companies(Private),Delhi,"Shervani Nagar, Sulem Sarai, Allahabad 211011, UP",+91-532-2102306,",shervaniind@rediffmail.com,",
Shellz Overseas Pvt Ltd,Companies(Private),Delhi,"D-3/1, Rana Pratap Bagh, New Delhi 110007, DL",+91-11-27414787,",tifosifoods3@hotmail.com,u003esumit.kumar@shellzoverseas.com,sumit.kumar@shellzoverseas.com,shellzoverseas7@hotmail.com,",
Shashi Industries,Companies(Private),Delhi,"1046, 4th M Block, Dr. Raj Kumar Road, Rajajinagar, Bangalore 560010, KA",+91-80-23203685,",shashiservices05@gmail.com,team.akjainco@gmail.com,glitz03@rediffmail.com,delhi@shahi.co.in,bkalia@gmail.com,",
Shalimar Chemical Works Ltd,Companies(Private),Delhi,"92-E, Alipore Road, Kolkata 700027, WB",+91-33-24792169,"saransh.jain@hindustantimes.com,,SRMANAGER.ACCOUNTS@SCWL-INDIA.COM,helpdesk@getdistributors.com,",
SC Johnson Products Pvt Ltd,Companies(Private),Delhi,"Plot No 68, 5th Floor, Sector 44, Gurgaon 122003, HR",+91-124-4173900,",JSmith@scj.com,amishr2@scj.com,aarora@scj.com,x3ezatalk2us@scj.com,zatalk2us@scj.com,JLSmith@scj.com,",
Sayona Colors Pvt Ltd,Companies(Private),Delhi,"201, University Plaza, Vijay Char Rasta, Navrangpura, Ahmedabad 380009, GJ","+91-79-66314147, +91-79-66314148",",sayona15@gmail.com,",
Saj Food Products Pvt Ltd (Bisk Farm),Companies(Private),Delhi,"5/1, Acharya Jagadish Chandra Bose Road, Purna Bhaban, Kolkata 700053, WB","+91-33-22818219, +91-33-22818369",",dibyendu@biskfarm.com,jane@biskfarm.com,x3edibyendu@biskfarm.com,",
Saife Vetmed Pvt Ltd,Companies(Private),Delhi,"129, 2nd Floor, Patparganj Industrial Area, Hassanpur, New Delhi 110092, DL",+91-11-22143932,",info@saifevetmed.com,u003einfo@saifevetmed.com,",
Roquette India Pvt Ltd,Companies(Private),Delhi,"702, 7th Floor, Powai Plaza, Hiranandani Garden, Powai, Mumbai 400076, MH","+91-22-42301503, +91-22-25706775",",x3eclifford.pinto@roquette.com,clifford.pinto@roquette.com,xx@roquette.com,",
Romana Herbalcare Pvt Ltd,Companies(Private),Delhi,"168, Udyog Vihar, Phase 1, Gurgaon 120016, HR","+91-124-4385168, +91-124-4222168",",romanaherbals@gmail.com,u003eromanaherbals@gmail.com,info_infotech@yahoo.co.in,",
RKTE Pvt Ltd,Companies(Private),Delhi,"6-4-98, 4/2, Aranvatata, Guntur 522007, AP","+91-863-2222220, +91-863-2220876",",sgtc_trade@yahoo.com,email@obhans.com,dp.indian@yahoo.co.in,ashok@ritevalue.org,",
Ripple Fragrances Pvt Ltd (NR Group),Companies(Private),Delhi,"2768 & 2769, Haripriya Complex, Temple Road, V. V Mohalla, Mysore 570002, KA",+91-821-4241541,,
Ricela Health Foods Ltd,Companies(Private),Delhi,"Saron Road, Dhuri, Sangrur, Malerkotla 148024, PB","+91-1675-220700, +91-1675-221100","jatin.ricela@gmail.com,,x3efinance.ricela@gmail.com,finance.ricela@gmail.com,",
Relish Food,Companies(Private),Delhi,"Post Box No 20, Valanjavazhy, Alleppy 688005, KL","+91-477-2272029, +91-477-2272459",",x3eviren@deepkiran.co.in,viren@deepkiran.co.in,sales@LawyerServices.in,info@LawyerServices.in,sunil@ambrosiarelishfoods.com,",
Reho Natural Ingredient,Companies(Private),Delhi,"192, Thadagam Road, Velandipalayam, Coimbatore 641025, TN",+91-422-2442848,"rehobothingredients@gmail.com,,lestonsam@gmail.com,",
Ramaa Incubators Pvt Ltd,Companies(Private),Delhi,"Survey No 538/B, Opposite To VNR College, Bowrampet Road, Bachupally, Qutubhullapur, Hyderabad 500043, TS","+91-40-64538689, +91-9505277799, +91-8586924135",",Ramaaincubatorspvtltd@yahoo.com,Rama@clarity-medical.com,rnd@nasanmedical.com,ramaa.incubators@gmail.com,info@aeonaudit.com,vikasbhandari2@gmail.com,",
Ralli Singh Pvt Ltd,Companies(Private),Delhi,"172, Mahatma Gandhi Road, Kolkata 700007, WB",+91-33-22688276,"accounts@rallisingh.com,u003eaccounts@rallisingh.com,arunkagarwalandassociates@gmail.com,,",
Rajdheer Wines Pvt Ltd,Companies(Private),Delhi,"7, Prince Tower, Near Chandak Circle, Tidke Colony, Nashik 422002, MH",+91-253-2310612,"rajvalue@gmail.com,,info@indianwinemagazine.com,u003erajvalue@gmail.com,",
Rainbow Packaging Pvt Ltd,Companies(Private),Delhi,"15-B, Changodar Industrial Estate, Sarkej Bawala Highway, Chandgodar, Sanand 382213, GJ","+91-2717-251151, +91-2717-251152",",rpplindia@yahoo.com,info@rainbowpackaging.in,",
Raghuvir Industries,Companies(Private),Delhi,"Plot No 13, G. I. D. C 2, Jamvadi, Gondal 360311, GJ",+91-9825027192,",raghuvirmetalcast@yahoo.com,saptharishifin@gmail.com,apodder@infomerics.com,shriganeshx15@yahoo.co.in,rmi_1997@rediffmail.com,marketing@raghuvirlifestyle.com,",
Radikal Foods Ltd,Companies(Private),Delhi,"28, Community Centre, Saket, New Delhi 110017, DL","+91-11-26566002, +91-11-26566003",",cs@radikalgroup.com,u003ecs@radikalgroup.com,",
R P Basmati Rice Ltd,Companies(Private),Delhi,"G. T Road, Madanpur, Karnal 132001, HR",+91-184-2002257,",vineyagoel@rediffmail.com,",
R J Biotech Ltd (RJ Group),Companies(Private),Delhi,"Siddharth Arcade, Opposite M T D C, Railway Station Road, Aurangabad 431001, MH","+91-240-2354917, +91-240-2354916",",investor@bigshareonline.com,corporategovernance@rjcorp.in,cfo@rjbiotech.com,",
Pure Temptation,Companies(Private),Delhi,"Near Tavdipura Post Office, Dudheshwar, Ahmedabad 380004, GJ","+91-79-25625071, +91-79-25626195",,
Pristine Organics Pvt Ltd,Companies(Private),Delhi,"839, 3rd Floor, 'A' Block, Damodaran Road, Sahakara Nagar, Bangalore 560092, KA",+91-80-43438484,",info@pristineorganics.com,",
Prime Bovine Genetics Pvt Ltd,Companies(Private),Delhi,"Hotels Park Plaza, 4thFoor, Corporate Office, Ferozpur Road, Ludhiana 141001, PB",+91-161-4378098,",cs@primemilk.in,cs@mhlin.com,",
Prestige Group Of Industries,Companies(Private),Delhi,"30, Jaora Compound, M. Y. H Road, Indore 452001, MP","+91-731-4011111, +91-731-4041111",",info@prestigeindia.com,properties@prestigeconstructions.com,x3einfo@prestigeindia.com,secretarial@prestigeconstructions.com,Investors@prestigeconstructions.com,x3esecretarial@prestigeconstructions.com,",
Prakash Agricultural Industries (Prakash),Companies(Private),Delhi,"Hathras Road, Foundry Nagar, Agra 282006, UP","+91-562-4009008, +91-562-2344348",",pilho@prakash.com,sales@prakashengine.com,info@prakash.in,ve@prakashindia.com,x3epilho@prakash.com,",
Polchem Hygiene Laboratories Pvt Ltd,Companies(Private),Delhi,"6, Gandharva Apartments, 28, Near Mehendale Garag, Erandawana, Pune 411004, MH",+91-20-25439858,",rakesh.shejwal@aartigroup.cominfo,exim@polchemgroup.com,ranjeet.patil@ceva.com,",
Pee Cee Cosma Sope Ltd,Companies(Private),Delhi,"G-10/8, Sanjay Place, Padam Deep, Agra 282002, UP",+91-562-2527330,",info@peeceecosma.com,PCCOSMA@DOCTORSOAP.COM,info@doctorsoap.com,pccosma@doctorsoap.com,",
Parisons Group of Companies (Parisons),Companies(Private),Delhi,"6/1183, Kunhipari Buildings, Kozhikode 673032, KL","+91-495-2365618, +91-495-2365652",",vivek@icraindia.com,info@parisons.com,",
Paramount Casting Pvt Ltd,Companies(Private),Delhi,"Near Railway Crossing, Naudhrani Road, Malerkotla 148023, PB",+91-1675-252836,",mktg@paramountcables.com,snj@aiaengineering.com,mumbai@paramountcables.com,info@paramountoverseas.co.in,info@paramount.net.in,paramountrolls@yahoo.co.in,x3einfo@paramount.net.in,info.paramountt@gmail.com,",
