Name,Sector,City,Address,Phone,Email,Lat-Long
The B School International,School,Malappuram,Chinakal Randathani; NH-Kottakkal Randathani; 676510,,"thebschool_ktkl@yahoo.co.in,info@thebschool.org,dr.mashrafpsyc@gmail.com,",10.9717563; 76.0061692
Hilal Public School,School,Malappuram, Ponnani; Ponnani; 679577,,"76255@cbseshiksha.in,info.hilalpublicschool@gmail.com,",10.77591959; 75.92171312
Acush Acupuncture Academy,School,Malappuram,Opp Boys High Sec School Thekkummuri; Kuttippuram Road Thekkummuri; 676105,,"niyaracu@gmail.com,",10.882401; 75.943755
Government Rajah's Higher Secondary School,School,Malappuram, Kottakkal; Malappuram Kottakkal; 676503,,"thomsthekkini@gmail.com,moonniyurhss@gmail.com,grhss11011@gmail.com,gbhssmanjeri11010@gmail.com,grhsskottakkal@gmail.com,info@mestcs.ac.in,",10.991089; 75.9951315
Delhi International School,School,Malappuram, Vengad; Valanchery Vengad; 679338,,"diskeralaprinci@gmail.com,info@internationaldelhischool.org,edudwar.com@gmail.com,",10.9143949; 76.1115185
Hill Top Public School,School,Malappuram, Kunnakkavu; Kunnakkavu; 679340,,"school.hilltop@yahoo.com,hilltopkkv@gmail.com,hilltoppublicschool@gmail.com,",10.9016272; 76.2513044
P P T M Higher Secondary School,School,Malappuram, Kondotti Malappuram; Kottukara Kondotti Malappuram; 673638,,"ppmhss@gmail.com,pptmyhscherur@gmail.com,info@mestcs.ac.in,",11.1390531; 75.9826754
