Name,Sector,City,Address,Phone,Email,Lat-Long
Suraj wanjari personal trainer and Unisex Gym - Best Gym in Nagpur,Gym,Nagpur,"3+ years in business · Plot No: 362, Floor No: 3, Wanjari Complex Doctor Ambedkar Road Kamal chowk",Open ⋅ Closes 11 pm · 084462 30863,,"21.1692205,79.0993817"
Fhive fitness,Gym,Nagpur,"5+ years in business · Plot no.04, 2nd floor, shree radhe govind, Ring Rd",Open ⋅ Closes 10 pm · 091457 33453,",Email-fhivefitness78@gmail.com,","21.1155697,79.0357962"
A-light Fitness,Gym,Nagpur,"3+ years in business · 2nd floor,Mohta apartments, Katol Rd, above sbi bank chhaoni",Open ⋅ Closes 10 pm · 085302 28896,,"21.168656,79.0756406"
BIG FIT,Gym,Nagpur,"3+ years in business · 3rd floor, 1, RPTS Rd, above Domino's",Open ⋅ Closes 10 pm · 090111 01654,,"21.1221966,79.0540167"
Core Fitness,Gym,Nagpur,3+ years in business · near Shahu Samaj Building,Open ⋅ Closes 11 pm · 090223 95046,",magnus.fitness@yahoo.com,info@magnusfitnessworld.com,","21.1507233,79.0811384"
SPL Fitness Hub,Gym,Nagpur,"7+ years in business · Pioneer Green Vally, Opp. Afzal Bakery, behind Vayusena Nagar",Open ⋅ Closes 10 pm · 097666 98739,",info@splfitnesshub.com,","21.1719152,79.0362423"
ULTRAFIT GYM,Gym,Nagpur,"5+ years in business · 17, S Ambazari Rd, Madhav Nagar, Nagpur, Maharashtra 440010",Open ⋅ Closes 9 pm · 077448 03819,,"21.1362509,79.0477181"
Platinum Gym,Gym,Nagpur,"7+ years in business · 169, 170, 1st floor, Mokha Tower, Umrer Rd",Open ⋅ Closes 11 pm · 077095 08005,",niranjanplatinumgym@gmail.com,","21.1160125,79.0347128"
The Fitness Aura,Gym,Nagpur,"5+ years in business · 1st Floor, 12, Jawahar society, Above wardhaman Ele, near Bharat Petrol Pump",Open ⋅ Closes 10:30 pm,,"21.129286,79.1191861"
oxygen gym,Gym,Nagpur,"5+ years in business · Borgoun, 1, Chowk",Open ⋅ Closes 10 pm · 082081 61085,,"21.1607255,79.041621"
FITNESS CLUB GYM,Gym,Nagpur,"5+ years in business · 1-4, Beltarodi Rd",Open ⋅ Closes 10 pm · 074474 48030,",info@jdcoem.ac.in,fitnessclubgym100@gmail.com,","21.1417719,78.9893412"
Oxygen Fitness Studio,Gym,Nagpur,"6th Floor, Natraj Tower, Zenda Square",Open ⋅ Closes 11:30 pm,,"21.141784,79.1088003"
Fitness King Gym,Gym,Nagpur,3+ years in business · 125/A,Open ⋅ Closes 11 pm · 097676 11113,,"21.156622,79.0817748"
Marvel Fitness,Gym,Nagpur,5+ years in business · MARVEL FITNESS GYM Laxmi Nagar near water tank plot No100 Opp Pitale Shashtri School,Open ⋅ Closes 10 pm · 098340 07388,",marvelfitnessln@gmail.com,","21.1101292,78.9904561"
"FITLIFE Gym | Wardha Rd, Nagpur",Gym,Nagpur,3+ years in business · Wardha Rd,Open ⋅ Closes 10 pm · 085520 04100,,"21.1160861,79.0693067"
Aspire The Fitness Hub,Gym,Nagpur,"3+ years in business · Sharda squre, 19, near Ayodhya Nagar, opposite smriti hall",Open ⋅ Closes 10 pm · 091757 64732,",info@splfitnesshub.com,","21.1176632,79.1053932"
Trans Fitness,Gym,Nagpur,"10+ years in business · Alankar-Kachipura Sq. road, Below Kutz Salon Near Federal Bank, Opp Firstcry Ramdaspeth Connects Laxminagar Bajaj Nagar Connects",Open ⋅ Closes 10:30 pm · 098603 44777,",ninfo@transfitness.in,info@transfitness.in,","21.1358438,79.0660791"
Armor Fitness,Gym,Nagpur,"5+ years in business · Plot no 183, Ring Rd",Open ⋅ Closes 10 pm · 089834 98082,",strongfitness39@gmail.com,","21.1076757,79.1140972"
Oneabove Fitness Ramdaspeth,Gym,Nagpur,"7+ years in business · 401/404 Near Sqaure, Milestone, 12, Wardha Rd",Open ⋅ Closes 10 pm · 090215 98563,,"21.1368503,79.0755653"
Bluerock Fitness,Gym,Nagpur,"3+ years in business · Plot No.183, Super Pride Building, Ring Rd",Open ⋅ Closes 10 pm · 082081 81564,",sarkaart@yahoo.com,","21.1886208,79.0908926"
Talwalkar's Nagpur (Now FITLIFE),Gym,Nagpur,"3+ years in business · Hindustan Colony, Aditya building, Wardha Rd, near Ajni square",Open ⋅ Closes 10 pm · 085520 04100,,"21.1162877,79.0695853"
Arnold's Gold Gym,Gym,Nagpur,7+ years in business · Kothi Rd,Open ⋅ Closes 11 pm · 097307 58977,"WeCare@GoldsGym.in,,","21.1577531,79.0878421"
Sai Fitness,Gym,Nagpur,"3+ years in business · R. K. Tower, above Capello Salon",Open ⋅ Closes 10 pm · 077989 33657,",sales@jeraifitness.com,","21.0956136,79.0759955"
ULTRAFIT GYM (Ravi Nagar),Gym,Nagpur,"5+ years in business · University Campus, near University Ground, opposite Panio Cafe",Open ⋅ Closes 9 pm · 090224 11860,",info@ultrafitgym.in,","21.1492355,79.0568108"
Surefit Wellness Center,Gym,Nagpur,"5+ years in business · Santaji Society Balpande Layout, Plot No 16, near Rachanavatika",Open ⋅ Closes 9 pm · 097661 53636,",surefit85@gmail.com,","21.1010779,79.0761162"
Fitness United,Gym,Nagpur,"3+ years in business · 1st Floor, Govindam Commercial",Open ⋅ Closes 11 pm · 077118 81139,",fitnessunitedgym@gmail.com,","21.1674732,79.0875191"
"New Olympia fitness planet, Nagpur",Gym,Nagpur,"3+ years in business · second floor, Indu Yash Complex, Cement Rd",Open ⋅ Closes 11 pm,",rahul.olympia@gmail.com,","21.1401758,79.0533123"
Mr. Deepak Ramteke Muscle And Fitness Gym,Gym,Nagpur,"7+ years in business · Guru Nanak School, Road",Open ⋅ Closes 10:30 pm · 094236 84495,,"21.171415,79.0905591"
People's Gym,Gym,Nagpur,"10+ years in business · 96, VIP Rd",Open ⋅ Closes 10:30 pm · 0712 663 9428,",info@peoplesgym.com,","21.1354529,79.0664551"
Oneplus Fitness,Gym,Nagpur,"3+ years in business · Suhyog 3rd floor above yes bank Telephone exchange square, Central Ave",Open ⋅ Closes 11 pm · 084110 93978,"md.imranfw@gmail.com,,","21.1485231,79.1167888"
The Rock Gym,Gym,Nagpur,"5+ years in business · Block no.102A, Shanti Park Apartment, Beltarodi Rd, above SBI",Open ⋅ Closes 10 pm · 090218 19018,,"21.088119,79.0785593"
Doc's Fitness,Gym,Nagpur,"Keshav Dwar, Reshimbag Square",Open ⋅ Closes 10 pm · 079722 40709,,"21.1339572,79.106126"
High Volume Fitness,Gym,Nagpur,"Shop No. 1, Himalaya Enclave, LAD Square",Open ⋅ Closes 10 pm · 099600 33368,",ankitbagde236@gmail.com,","21.1338783,79.0531472"
Barbarian Power Gym,Gym,Nagpur,"Jagat towers, Amravati Rd, near law college square",Open ⋅ Closes 10 pm,",kelkarsuresh82@gmail.com,","21.1434739,79.0482934"
Outraw Training Gym - Fitness Center,Gym,Nagpur,"5+ years in business · West High Court road, dharampeth",Open ⋅ Closes 10 pm · 089835 36321,",outrawgym2@gmail.com,","21.138745,79.0576001"
Fitness Factory gym,Gym,Nagpur,"10+ years in business · Plot no. 319, 1st floor, Gandhi grain, Chhapru Nagar chowk, Central Ave, near indusland bank",Open ⋅ Closes 10 pm,",aoxindecathy@163.com,","21.1483174,79.1212988"
Solid Body Fitness Gym,Gym,Nagpur,"7+ years in business · 3rd Floor, Jagdamaba Appt, Shyam Talkies Chowk",Open ⋅ Closes 11 pm · 098901 96031,"md.imranfw@gmail.com,,","21.1477611,79.1013919"
MultiFit Nagpur,Gym,Nagpur,"3+ years in business · 3rd Floor, Imperial Court, Rangole Marg, near Traffic Park",Open ⋅ Closes 10 pm · 077987 00050,",contact@multifit.co.in,","21.1389213,79.0627399"
Fitness Freaks Gym,Gym,Nagpur,"5+ years in business · Plot No. 182, Beside Vishal Mega Mart Aadarsh Abhyasika, Bhande Plot Square Nandanwan Road",Open ⋅ Closes 10 pm · 087796 82234,",fitnessfreaks40@gmail.com,","21.1238599,79.1152544"
Prime Fitness Gym - Best Gym In Friends Colony,Gym,Nagpur,"10+ years in business · Sai Plaza, H.No 551/3, Katol Rd, near Apna Bhandar",Open ⋅ Closes 10:30 pm,",yogeshdhanorkar@yahoo.in,","21.1776775,79.0443648"
A S-FITNESS,Gym,Nagpur,3+ years in business · Plot no u-24 Duchakke mention,Open ⋅ Closes 10 pm · 088889 03545,",memberexperience@anytimefitness.in,","21.1085113,79.0751562"
Physique Today Gym,Gym,Nagpur,"30+ years in business · Mount Road, Rizvi Galli, behind Lemanna Garage",Open ⋅ Closes 10 pm · 090211 92596,,"21.1607568,79.0748004"
The Ab's Gym,Gym,Nagpur,"7+ years in business · Plot No 4, 33QJ+W54, Manohar Arcade, Somalwada Rd",Open ⋅ Closes 10 pm · 090759 35192,",nileshdhote2007@rediffmail.com,","21.0903277,79.0781777"
Gaikwad Fitness Club,Gym,Nagpur,"Plot no.1060, Ambedkar Marg Cement road, opposite IDBI BANK ATM",Open ⋅ Closes 11 pm · 082082 21618,",contact@gpis-edu.org,ncontact@gpis-edu.org,info@jdcoem.ac.in,","21.1693429,79.1126716"
R K Fitness Factory,Gym,Nagpur,"47, Saw Mills Area Bhoslewadi, Lashkari Bagh Rd",Open ⋅ Closes 11 pm,",rkfitnessdwarka@gmail.com,u003erkfitnessdwarka@gmail.com,","21.165293,79.0941374"
Fitness life gym (Unisex),Gym,Nagpur,"plot no.140, near panchpaoli police station",Open ⋅ Closes 10 pm,,"21.1648561,79.1054645"
WESTERN FITNESS GYM,Gym,Nagpur,"2nd floor, Bajaj Nagar Rd, above Waman Hari Pethe Jewellers",Open ⋅ Closes 9:30 pm,",sales@jeraifitness.com,","21.1294056,79.0601434"
Reshape Fitness Studio,Gym,Nagpur,House No.18 Golibar Square,Open ⋅ Closes 10 pm,",thefitnessdoctor16@gmail.com,","21.1560251,79.1018318"
JAGUARs FITNESS & Nutritionist,Gym,Nagpur,"3+ years in business · Plot No 40, Ambazari Rd",Open ⋅ Closes 9 pm · 095618 03885,,"21.1327404,79.0520528"
Fitness World Gym (Unisex Gym),Gym,Nagpur,"10+ years in business · Nagpur, Maharashtra",Open ⋅ Closes 10 pm · 092252 19244,,"21.1411655,79.0919696"
Energetic Fitness Gym Shree Ganesh Complex,Gym,Nagpur,"5+ years in business · Nagpur, Maharashtra",Open ⋅ Closes 9:30 pm · 098230 17367,,"21.1102004,79.1150657"
Being Fit Gym,Gym,Nagpur,"5+ years in business · 53, Rameshwari Rd",Open ⋅ Closes 10:30 pm · 095615 08197,",strongfitness39@gmail.com,","21.1319287,79.0898624"
CURVES EVOLUTION GYM & FITNESS,Gym,Nagpur,"2nd Floor, MISSAL LAYOUT, PLOT NO 3, Mangalwari Market Rd",Open ⋅ Closes 10 pm · 089993 27314,,"21.1862982,79.0938043"
Sweat 7 Fitness,Gym,Nagpur,"5+ years in business · House no 465, Raj bhavan, Meghraj Golchha Rd",Open ⋅ Closes 10 pm · 095613 67299,,"21.1629441,79.0752353"
Fitness Revolution,Gym,Nagpur,"7+ years in business · Nilay Murarka Marg, opposite santoshi mata Mandir, Modal Mill Square",Open ⋅ Closes 11 pm · 097669 35508,",ninfo@fitnessrevolution.in,pravesh.chokhandre@gmail.com,info@fitnessrevolution.in,","21.1138012,78.998835"
4R Fitness Power House,Gym,Nagpur,"3+ years in business · Plot no 9, Parmar Building, near chitnavispura bank",Open ⋅ Closes 10 pm · 088886 44438,"fourrfitness@gmail.com,,u003efourrfitness@gmail.com,info@powerhousegym.com,","21.1175817,79.1084554"
Avi's Fitness Studio,Gym,Nagpur,"7+ years in business · JK Tower, 254",Open ⋅ Closes 10:45 pm · 093700 00888,",info@avis-fitnessstudio.com,ninfo@avis-fitnessstudio.com,","21.1247413,79.0575968"
Endurance Fitness club,Gym,Nagpur,"5+ years in business · Plot no 2, 4, IT Park Rd",Open ⋅ Closes 10 pm · 099234 31462,,"21.1303582,79.0398729"
Black Box Fitness Studio,Gym,Nagpur,"7+ years in business · Abhinay Sankul, Abhyankar Nagar Rd, above Food Maholla Rest, opposite Tanjoor Rest",Open ⋅ Closes 9 pm · 086688 06214,",info@blackboxfitnessstudio.in,blackboxfitnessstudio@gmail.com,","21.1272872,79.055633"
FITNESS CLUB GYM,Gym,Nagpur,"5+ years in business · 14TH, Ambazari Rd, near NIT SWIMMING POOL",Open ⋅ Closes 10 pm · 098236 13167,",info@jdcoem.ac.in,fitnessclubgym100@gmail.com,","21.1417719,78.9893412"
Oneabove Fitness byramji town,Gym,Nagpur,15+ years in business · Ground J.P. Heights 4/1 Gondvana Chowk RBI Officer's Colony Byramji Town,Open ⋅ Closes 10 pm · 090217 38978,,"21.1743363,79.0818011"
New Muscle Magic Gym,Gym,Nagpur,"7+ years in business · Ground Floor, YMCA Complex, Khalasi Ln, near St.John's High School",Open ⋅ Closes 11 pm · 097676 11113,,"21.1603403,79.0823206"
Arnold's Gold Gym,Gym,Nagpur,10+ years in business · Mecosabagh Rd,Open ⋅ Closes 11 pm · 098901 11033,"WeCare@GoldsGym.in,,","21.1577531,79.0878421"
ad's Fitness World,Gym,Nagpur,"3+ years in business · 2105, 10B, IT Park Rd",Open ⋅ Closes 9:30 pm · 099604 53519,,"21.1145456,79.0436479"
Fitness Courtyard,Gym,Nagpur,"3+ years in business · Banode square, New shukrawari, near Patil Hospital",Open ⋅ Closes 10:30 pm · 097669 19117,,"21.1416078,79.0407671"
Avenger Fitness Hub,Gym,Nagpur,"3+ years in business · Bus Stop, Nandanvan Last, opposite Rajendra High School",Open ⋅ Closes 11 pm · 093256 88317,",info@splfitnesshub.com,","21.125932,79.1061769"
Universal Gym (Mens & Women's),Gym,Nagpur,"5+ years in business · Sai-lila niwas, plot no 21, shubhangi society 2 Near Balaji temple",Open ⋅ Closes 10 pm · 091581 06963,,"21.0861303,79.0855025"
The Warriors gym,Gym,Nagpur,"5+ years in business · Plot no 29 A jagrut nagar, Ring Rd, near chandni bar Nari",Open ⋅ Closes 10 pm · 098909 89193,",mmafiofficial@gmail.com,","21.188095,79.0966343"
Krishna fitness - Gym-Koradi-Nagpur,Gym,Nagpur,"5+ years in business · KORADI ROAD, BAJRANG NAGAR LANE NO 2 KRISHNA FITNESS GYM KORADI ROAD BAJRANG NAGAR LANE, NO 2, Koradi Rd, near BHARAT PETROL PUMP & SARASWATI HIGH SCHOOL",Open ⋅ Closes 9 pm · 097307 56892,,"21.2269786,79.0791166"
"Cult Dharampeth - Gym in Dharampeth, Nagpur",Gym,Nagpur,"3rd Floor, The West High, Plot 236, W High Ct Rd",Open ⋅ Closes 10 pm · 095038 88398,",hello@curefit.com,hello@cult.fit,x3ehello@cult.fit,","21.1433745,79.0587769"
Southern Hill Fitness,Gym,Nagpur,"3+ years in business · Southern hill fitness, 2'nd floor, Chhaoni Rd, opposite Achraj Tower 2",Open ⋅ Closes 9 pm · 091455 05544,",southernhillfitness@gmail.com,","21.16828,79.0761855"
Fit Nation Unisex Gym,Gym,Nagpur,"Ratan Nagar Mankapur, Ring Rd",Open ⋅ Closes 11 pm · 087931 18752,,"21.1887383,79.0760557"
The Pulse Fitness,Gym,Nagpur,"7+ years in business · Sant Jagnade Square, Great Nag Road, Nandanvan",Open ⋅ Closes 10 pm · 099230 23017,,"21.1382899,79.1171399"
Big Tech Panther's Gym,Gym,Nagpur,"3+ years in business · 93c, Manewada Rd, behind Devendra lawn",Open ⋅ Closes 10 pm · 084829 04809,,"21.104396,79.1020173"
Hardcore Fitness Hub - Gym for Ladies & Gents,Gym,Nagpur,"3+ years in business · Fawara Square, Wade Bhawan, 3rd Floor, Central Ave",Open ⋅ Closes 11 pm · 084120 58556,,"21.150686,79.1009751"
AARON FITNESS STUDIO,Gym,Nagpur,"3+ years in business · plot no.231, Patankar Chowk Rd",Open ⋅ Closes 11 pm · 072198 89175,",aaronmktg@yahoo.com,","21.181942,79.0941901"
Muscle Box Gym,Gym,Nagpur,"3+ years in business · Plot No. 82, 1st Floor, in front of Mayur Mangal Karyalaya",Open ⋅ Closes 9 pm · 095033 44167,",blackboxfitnessstudio@gmail.com,","21.1365222,79.1137283"
Dr. Sudhir's Fitness,Gym,Nagpur,"5+ years in business · Plot no 8 , Matrutirth, Manewada - Besa Rd, behind Vrundavan lawns",Open ⋅ Closes 10 pm · 093736 66905,",info@fitlineindia.com,dr.neelamss@gmail.com,","21.0974087,79.0984989"
Go gym,Gym,Nagpur,"5+ years in business · Plot No.864/C, 1 st Floor, Opp.Rahate Hospital, CA Road, near Kolbaswamy Chowk Old",Open ⋅ Closes 11 pm · 099214 42623,",strongfitness39@gmail.com,","21.1487002,79.1141186"
Terminator Gym,Gym,Nagpur,"7+ years in business · 44W7+65Q, Ayachit Rd, behind Bhosla Ved Shala, near Sankat Mochan Hanuman Mandir",Open ⋅ Closes 11 pm · 093269 37138,,"21.145586,79.1104049"
Xtreme full fitness hub,Gym,Nagpur,"Rani durgavati Chawk, opposite to police chawki, near by Gurudwara Road",Open 24 hours · 090674 81706,,"21.1737841,79.1134355"
Combat Fitness Club,Gym,Nagpur,"3+ years in business · Akash mall, Ayachit Rd",Open ⋅ Closes 10 pm · 086249 46706,"md.imranfw@gmail.com,,","21.1637667,79.0806781"
Orange Fitness,Gym,Nagpur,"3+ years in business · Diamond Tower, Mankapur Rd, near Basera Apartment",Open ⋅ Closes 10 pm · 083295 21579,,"21.1893737,79.0759047"
Millennium Health Club - GYM Trimurti Nagar,Gym,Nagpur,"10+ years in business · Ring Road, 31, Parekh Layout",Open ⋅ Closes 10 pm · 099605 67082,,"21.1155917,79.0389358"
Arena Gym & Health Club,Gym,Nagpur,10+ years in business · Manewada Rd,Open ⋅ Closes 11 pm · 097664 45077,,"21.10611,79.0994367"
Parate's Fitness Club,Gym,Nagpur,"7+ years in business · Parate Complex, Khamla Rd, opposite Gulmohar hall",Open ⋅ Closes 10 pm · 087889 19539,",info@jdcoem.ac.in,","21.11045,79.0605791"
SHREE GYM,Gym,Nagpur,"5+ years in business · 2nd floor, Balaji Kirana Store, Nandanvan Road, road, opposite ICICI Bank",Open ⋅ Closes 11 pm · 086984 09603,",shivajiscience_ngp@yahoo.com,","21.0817389,79.0418978"
Avis Fitness Studio,Gym,Nagpur,"7+ years in business · Nagpur, Maharashtra",Open ⋅ Closes 12 am · 093705 45566,",info@avis-fitnessstudio.com,","21.1272062,79.0575968"
HOUSE OF FITNESS,Gym,Nagpur,"HOUSE OF FITNESS 136, Ring Rd, behind Shivshankar Lawn",Open ⋅ Closes 10 pm · 093257 23086,",info@powerhousegym.com,","21.1418479,79.1042944"
EVOLVE FITNESS STUDIO,Gym,Nagpur,"7+ years in business · Nagpur, Maharashtra",Open ⋅ Closes 9:30 pm · 072767 00850,"ninfo@evolvefitness.co.in,info@evolvefitness.co.in,,","21.1388506,79.0634304"
Limitless,Gym,Nagpur,"2nd Floor, sq, The Cennet, Central Ave, above Pizza Hut",Open ⋅ Closes 11 pm · 075075 01176,",info@limitlessfit.in,","21.1483125,79.1309134"
YADAV'S FITNESS FACTORY,Gym,Nagpur,"3+ years in business · plot no 69, Hudkeshwar Rd",Open ⋅ Closes 10 pm · 093251 64160,",solanki.abhi466@gmail.com,","21.101711,79.119141"
A-SQUARE FITNESS STUDIO,Gym,Nagpur,"near Shubhash Putla, beside Dinesh Medical Store",Open ⋅ Closes 10 pm · 074105 70062,",blackboxfitnessstudio@gmail.com,","21.1542302,79.1165383"
Body Zone Gym,Gym,Nagpur,7+ years in business · Nara Rd,Open ⋅ Closes 10 pm · 076203 51035,"bodyzonefitnesscentre@gmail.com,,u003ebodyzonefitnesscentre@gmail.com,cchinmay@gmail.com,","21.186873,79.0891999"
Gladiator gym,Gym,Nagpur,"5+ years in business · Sakore Complex, Ramna Maroti Rd",Open ⋅ Closes 10 pm,",hello@curefit.com,guruym.gym@gmail.com,","21.1231176,79.1277037"
Fitness India,Gym,Nagpur,"7+ years in business · Siddi Vinayak Apartment, Plot No.1, Gajanan Mandir Rd",Open ⋅ Closes 9 pm,",memberexperience@anytimefitness.in,magnus.fitness@yahoo.com,info@magnusfitnessworld.com,fitnessclubgym100@gmail.com,","21.1379873,79.0427571"
REVOLVE FITNESS GYM,Gym,Nagpur,"56 57, Chichbhavan Main Road, near Bhavans School",Open ⋅ Closes 10 pm · 080871 18714,",revolvefitnessgym@gmail.com,","21.0695435,79.0686575"
Akhaada - The Performance Studio,Gym,Nagpur,"5+ years in business · Akhaada - The Performance Studio, 19, Red Cross Rd",Open ⋅ Closes 9 pm · 090962 12123,,"21.1606776,79.0743148"
STRONG FITNESS,Gym,Nagpur,"Ingle House, 9, Ring Rd, near Indian Oil",Open ⋅ Closes 10 pm · 096650 48850,",strongfitness39@gmail.com,","21.1135593,79.0413635"
Power House Gym,Gym,Nagpur,5+ years in business · 1442,Open ⋅ Closes 10 pm · 088550 61090,",info@powerhousegym.com,jack@colorpowered.com,hukrenandu@gmail.com,","21.1477572,78.9813274"
MB Fitness GYM,Gym,Nagpur,"5+ years in business · Hingna Rd, near babbus restaurant",Open ⋅ Closes 11 pm · 099700 96063,,"21.1194569,79.0190751"
IMPULSE GYM,Gym,Nagpur,44GH+CC8,Open ⋅ Closes 10 pm · 095031 77274,",hello@curefit.com,","21.126046,79.1260062"
Pohankar's Fitness Studios,Gym,Nagpur,"5+ years in business · T-Point, Government Press Society, 57, near Ring Road",Open ⋅ Closes 10 pm · 083083 12111,",pohankarsfitness@gmail.com,","21.1187917,79.0293412"
360 Functional Fit,Gym,Nagpur,"7+ years in business · 3A, Mecosabagh Rd",Open ⋅ Closes 11 pm · 099753 21300,,"21.171439,79.0832571"
Pulse on fitness,Gym,Nagpur,"5+ years in business · Clark town,aanand sai marg,opp jay kranti society,kadbi square",Open ⋅ Closes 11 pm · 097305 79712,,"21.1650036,79.0552507"
Fitness For Life - The Ladies Workout Studio,Gym,Nagpur,"5+ years in business · pankaj trading company, Plot no 108, lane, beside maa bhagwati devi mandir",Open ⋅ Closes 9 pm · 086687 19453,,"21.1804113,79.0875036"
Ace Fitness Studio,Gym,Nagpur,"3+ years in business · 78, Manewada Rd",Open ⋅ Closes 9 pm · 080102 86821,"support@acefitness.org,x3esupport@acefitness.org,x22support@acefitness.org,,","21.0989808,79.0901801"
Feel The Burn Fitness Nagpur,Gym,Nagpur,"3+ years in business · Near Kamgar Kalyan Swimming Pool, Sakkardara Rd",Open ⋅ Closes 10 pm · 080877 49466,,"21.1256073,79.1084422"
Fitness Garage,Gym,Nagpur,5+ years in business · p.no 186 behind gurunanak bhavan kamal road ashok nagar,Open ⋅ Closes 10 pm · 089831 16487,,"21.1684458,79.103559"
Narayani FIT & ACTIVE Gym Nagpur,Gym,Nagpur,"7+ years in business · 3rd & 4th Floor, Vimal Plaza, Plot No. 190, Central Ave, behind INOX Building",Open ⋅ Closes 10 pm,,"21.147729,79.1329811"
HIGH FITNESS GYM,Gym,Nagpur,5+ years in business · 67,Open ⋅ Closes 10:30 pm · 073850 38383,",contact@multifit.co.in,","21.1948188,79.1010392"
AJJU'S GYM,Gym,Nagpur,"7+ years in business · Plot no. 15, Gopal Nagar, Road",Open ⋅ Closes 10 pm · 098231 82020,",hello@curefit.com,","21.1149396,79.0462829"
NFS-NASRE'S FITNESS STUDIO,Gym,Nagpur,"Plot Number 2, above Nasre Kirana Store",Open ⋅ Closes 10 pm,,"21.1127762,79.0881233"
Avis Fitness Studio,Gym,Nagpur,"Plot No 27 A Cement Road, beside Jogger Fitness Club",Open ⋅ Closes 11 pm · 090110 01666,",info@avis-fitnessstudio.com,","21.1272062,79.0575968"
DP's Fitness,Gym,Nagpur,"3+ years in business · 57, behind chota tajbag",Open ⋅ Closes 10 pm,,"21.1212264,79.1094425"
Fitness World Unisex Gym,Gym,Nagpur,"3+ years in business · Nagpur, Maharashtra",Open ⋅ Closes 10 pm · 085529 49501,"manish.singh@fitness-world.in,,","21.1539485,79.0473403"
Fitlife Gym,Gym,Nagpur,"5+ years in business · Opposite Paatidar samaj, near Great Nag Road, opposite to Paatidar Bhawan",Open ⋅ Closes 10 pm · 098345 88136,,"21.1259304,79.0698311"
Nandanwar's Gym,Gym,Nagpur,"7+ years in business · Mangalmurti Complex, Ring Rd, Opp. NIT Garden",Open ⋅ Closes 9:30 pm · 093250 08361,,"21.1140742,79.0414605"
KRUNAL GYM FITNESS,Gym,Nagpur,"5+ years in business · Plot No 40 A, Manewada - Besa Rd, near Bhavani Sabhagruha",Open ⋅ Closes 10:30 pm · 089833 99830,",sfs_college@yahoo.com,","21.094146,79.0966237"
Mahabali's Fitness First,Gym,Nagpur,7+ years in business · 3461/A5,Open ⋅ Closes 10 pm · 094221 48292,,"21.1087205,79.074071"
fitness Cyclone,Gym,Nagpur,"3+ years in business · Byramji Town, Gondwana Sq",Open ⋅ Closes 10 pm · 097667 08910,"counsellor@studies-overseas.com,,","21.1741004,79.080655"
Grunt Fitness,Gym,Nagpur,ADBA Sports Complex,Open ⋅ Closes 10 pm,,"21.1734433,79.04527"
Pal Fitness,Gym,Nagpur,"Suyog Nagar Square, p no 47/48 Saket nagar, behind TVS show room",Open ⋅ Closes 10 pm · 090283 80933,,"21.1295147,78.9591876"
MARVEL FITNESS MANISH NAGAR BRANCH,Gym,Nagpur,"Plot no 36, anand enclave, above mahindra first choice",Open ⋅ Closes 10 pm · 077091 71914,,"21.0944571,79.0793696"
Fitzmax Fitness,Gym,Nagpur,5+ years in business · behind Royal celebration,Open ⋅ Closes 10 pm,,"21.1336941,79.1031742"
dev health club,Gym,Nagpur,5+ years in business · 1985/A/103/C,Open ⋅ Closes 10 pm · 090493 35322,",sales@tsysinfo.com,","21.1372778,79.0462395"
Kings Fitness Club,Gym,Nagpur,7+ years in business · MSH 9,Open ⋅ Closes 10 pm,,"21.1274854,79.1140602"
Joshi's Exclusive - The Fitness Park,Gym,Nagpur,"20+ years in business · Plot No. 134, Sita Niwas, Dr, Balraj Marg",Open ⋅ Closes 9 pm · 093723 06180,",thefitnessdoctor16@gmail.com,info@peoplesgym.com,info@avis-fitnessstudio.com,","21.1337864,79.0795387"
Zumba Fitness Studio & Gym,Gym,Nagpur,7+ years in business · above HDFC BANK,Open ⋅ Closes 8:30 pm · 094037 80518,,"21.1035802,79.0568236"
NOTION FITNESS,Gym,Nagpur,"House no - 191, Cement Road, near Venu Corner",Open ⋅ Closes 10 pm,",info@fitlineindia.com,","21.1115049,79.0985678"
Fitness DNA,Gym,Nagpur,"3+ years in business · Block no.201, rawel plaza, above hdfc bank home loan office",Open ⋅ Closes 10:30 pm,",sales@jeraifitness.com,","21.1687057,79.089521"
Pumping Iron Gym,Gym,Nagpur,7+ years in business · 5484+C3M Vithoba akhada,Open ⋅ Closes 11 pm · 093266 47897,,"21.1755856,79.087228"
J. D FITNESS,Gym,Nagpur,"J D FITNESS, Great Nag Rd",Open ⋅ Closes 9 pm,",info@fitlineindia.com,ufitdelhi@gmail.com,","21.138324,79.1120185"
360 CrossFit Gym,Gym,Nagpur,5+ years in business · near NIT Complex,Open ⋅ Closes 10 pm · 070665 50360,",360crossfitgym@gmail.com,","21.1295804,79.1195412"
Wellness Gym Nagpur,Gym,Nagpur,Katol Rd,Open ⋅ Closes 10 pm,",support@gymcompany.co.za,inquiry@wellnessclub.co.in,fitnessclubgym100@gmail.com,Inquiry@wellnessclub.co.in,","21.1736923,79.0542718"
ABS Fitness,Gym,Nagpur,10+ years in business · Ring Rd,Open ⋅ Closes 10 pm · 088884 53205,",nileshdhote2007@rediffmail.com,","21.1383176,79.0334417"
The fitness time gym,Gym,Nagpur,"19, Godhani Road",Open ⋅ Closes 10 pm,",strongfitness39@gmail.com,contact@multifit.co.in,","21.1966105,79.0669712"
MAHARANA FITNESS COURT,Gym,Nagpur,"7+ years in business · 72, Rameshwari Rd",Open ⋅ Closes 10 pm,,"21.1202243,79.0909278"
Barbarian Power Gym,Gym,Nagpur,"3+ years in business · 1st Floor Ganga Kashi Mall Jagnade Square, Great Nag Rd",Open ⋅ Closes 10 pm · 098214 20509,",kelkarsuresh82@gmail.com,","21.1434739,79.0482934"
Capital Health Club,Gym,Nagpur,"7+ years in business · 27, Khamla Rd",Open ⋅ Closes 10 pm · 099234 31675,,"21.1142333,79.0640084"
AJAZ FITNESS,Gym,Nagpur,"3+ years in business · 2, Koradi Rd",Open ⋅ Closes 11 pm · 073858 65523,",info@fitlineindia.com,","21.1831084,79.0759826"
CrossXFit - CrossFit & MMA Gym,Gym,Nagpur,"3rd Floor, Above Union Bank, near Batukbhai Jewellers",Open ⋅ Closes 9 pm,,"21.1385917,79.057585"
Focus Fitness,Gym,Nagpur,5+ years in business · Gorewada Rd,Open ⋅ Closes 10 pm · 089836 15131,",xmanagement-services-bg.jpg.pagespeed.ic.xYUXFOlPQo@2x.jpg,","21.1800353,79.052297"
UC fitness unisex gym,Gym,Nagpur,"3+ years in business · plot no. 34, 36",Open ⋅ Closes 11 pm,,"21.1917725,79.0696375"
