Name,Sector,City,Address,Phone,Email,Lat-Long
Archannaa Fitnessz - Nagpur,Gym,Nagpur,"37, Near Deshmukh Nursing Home, Deendayal Colony, Gopal Nagar, Nagpur 440022, MH",+91-7947442272,,"21.124326,79.0174234"
ABS Fitness - Nagpur,Gym,Nagpur,"30, Teachers Colony, Jafar Nagar, Nagpur 440013, MH",+91-8050988416,",nileshdhote2007@rediffmail.com,","21.1383176,79.0485061"
4R Fitness Power House - Nagpur,Gym,Nagpur,"Plot no 9, Parmar Building, near chitnavispura bank, Ayodhya nagar, Nagpur, Maharashtra 440024",088886 44438,"fourrfitness@gmail.com,,u003efourrfitness@gmail.com,info@powerhousegym.com,","21.1175817,79.1084554"
Tejas Health & Wellness - Sahakar Nagar - Nagpur,Gym,Nagpur,"Tejas Palace, near, Jyoti School Rd, Gadge Baba Nagar, New Sahakar Nagar, Kharbi, Nagpur, Maharashtra 440024",098222 22124,,"21.1223583,79.1284313"
Infinity Fitness Unisex Gym - Nagpur,Gym,Nagpur,"53PR+HWQ, Nara Rd, above AXIS BANK, Kukreja Nagar, Nagpur, Maharashtra 440014",097666 98853,,"21.1864625,79.0897856"
Om Fitness Junction - Manish Nagar - Nagpur,Gym,Nagpur,"185, Perfect Plaza, Near Railway Crossing, Manish Nagar, Nagpur 440015, MH",+91-9371714112,,
Figure Femi - Jaitala Road - Nagpur,Gym,Nagpur,"123, Nelco Society, Jaitala Road, Subhash Nagar, Nagpur 440016, MH",+91-9850384812,",bhavana.kunnawar@rediffmail.com,",
Dance Madness Club - Dharampeth - Nagpur,Gym,Nagpur,"Laxmibhawan Square, Near Milton Shop, W H C Road, Dharampeth, Nagpur 440010, MH","+91-9371467366, +91-9325423208",,
Body Zone Gym - Jaripatka - Nagpur,Gym,Nagpur,"Jaripatka, Nagpur 440014, MH","+91-9960385115, +91)9767628756",,
Barbarian Power Gym - Sardar Bazar - Nagpur,Gym,Nagpur,"Kingsway, Sadar Bazar, Nagpur 440001, MH",+91-9823013209,",barbarian-power-gym-nagpur-0eg@dd5lu.html,",
Avis Fitness Studio - Gandhibagh - Nagpur,Gym,Nagpur,"Saptarushi Building, Near Kali Mata Mandir, Gandhi Bagh, Nagpur 440002, MH","+91-9260202490, +91-9665018489, +91-9370565597",",info@avis-fitnessstudio.com,",
Arjun Gym - Jaitala Road - Nagpur,Gym,Nagpur,"1, Perfect Housing Society, Near Mangal Murti Square, Jaitala Road, Nagpur 440016, MH",+91-9422811463,,
Anytime Fitness - Civil Line - Nagpur,Gym,Nagpur,"Near Vidan Bhavan, Civil Line, Nagpur 440001, MH","+91-712-2532999, +91-9764624259",",memberexperience@anytimefitness.in,",
