Name,Sector,City,Address,Phone,Email,Lat-Long
Wake UP Multi Gym - G T Road South - Howrah,Gym,Howrah,"38/2, Kadamtala, Opposite To Bridge And Roof Company, G T Road, Howrah 711101, WB","+91-9831273610, +91-9831210953, +91-33-65407882",,
VLCC - Dr Abani Dutta Road - Howrah,Gym,Howrah,"35/A/11/A/12, Dr Abani Dutta Road, Howrah 711101, WB","+91-33-26757231, +91-33-26757232, +91-33-26757233",,
The Workout Zone - G T Road - Howrah,Gym,Howrah,"101, G T Road, Howrah 711101, WB","+91-33-32015139, +91-9883475648",,
Shape Up - Dr Abani Dutta Road - Howrah,Gym,Howrah,"35, Vindhyachal Apartment, Near Howrah AC Market, Dr Abani Dutta Road, Howrah 711101, WB",+91-9831074897,,
Keep Fit Multi Gym And Health Club - Ramcharan Seth Road - Howrah,Gym,Howrah,"44/1, Santragachhi More, Ramrajatala, Ramcharan Seth Road, Howrah 711104, WB","+91-33-26771807, +91-9830034235, +91-9836759309",,
Fusion - Kadamtala - Howrah,Gym,Howrah,"102/2, Howrah Mitra Shangha Hospital, Raj Ballav Saha Lane, Kadamtala, Howrah 711101, WB",+91-33-66246696,,
Devarshi Yogapith - GT Road - Howrah,Gym,Howrah,"10, Near Gramin Bank, GT Road, Howrah 711101, WB",+91-33-26412614,,
A One Body Massage - Salkia - Howrah,Gym,Howrah,"144/17, Dharmatala Road, Salkia, Howrah 711106, WB","+91-9831413605, +91-33-26556094",,
