Name,Sector,City,Address,Phone,Email,Lat-Long
CDAC - Centre for Development of Advanced Computing,College,PPP,,,",x3eacts@cdac.in,course-enquiry@cdac.in,techsupport@cdac.in,actssupport@cdac.in,acts@cdac.in,secretary.icsta2023@cdac.in,","18.4759913,73.7461982"
Rasiklal M. Dhariwal Institute of Technology,College,PPP,"near Fattechand Jain School, near juna jakat naka, Pawana Nagar Housing Society, Chinchwad, Pimpri-Chinchwad, Maharashtra 411033",,",rmdiper@gmail.com,info@sjvpmp.org.in,","18.6324189,73.7747454"
Camp Education Society’s Institute of Management,College,PPP,"Camp Education Society's Rasiklal M. Dhariwal Institute of Management, near Lokmanya Hospital, Sector No 27/A, Nigdi, Pimpri-Chinchwad, Maharashtra 411044",,",director@campmba.com,director.campmba@gmail.com,","18.6533513,73.7700736"
"Maya Academy of Advanced Cinematics, Camp",College,PPP,,,",careers@aptech.ac.in,grievances-hppa.crid@hry.gov.in,","18.4760581,73.8698087"
Novel College of BBA and BCA,College,PPP,,,",gccbachd@hotmail.com.com,ich38.cl@unishivaji.ac.in,dkasccollege@gmail.com,","18.5566714,73.698953"
Shri Bhimashankar B.Ed. College,College,PPP,"2V6R+QX8, Landewadi,Manchar,Ambegaon, Maharashtra 410503",,"bhimshankar_b.edcollege@rediffmail.com,,info@shreebhairavnatheducation.com,bhimashankarbed@rediffmail.com,","19.011916,73.8898648"
Talentedge - Lincoln University College,College,PPP,,,",admissions@lincolnuca.edu,helpline@lincoln.edu.my,admissions@lincoln.edu,amiya@lincoln.edu.my,info@lincoln.edu.my,x3einfo@lincoln.edu.my,x3eadmissions@lincoln.edu,lucalifornia@lincolnuca.edu,x22admissions@lincoln.edu,banerjee@lincoln.edu.my,","18.4760628,73.9007086"
Savitribai Phule Mahila Mahavidyalaya,College,PPP,"Karmaveer Samadhi Parisar, Raviwar Peth Rd, kesarkar peth, Powai Naka, Satara, Maharashtra 415001",,",mavalspm@gmail.com,info@mjpedugroup.com,sfmm709@sgbau.ac.in,savitribai_phule@yahoo.com,","17.6849487,74.0008383"
