Name,Sector,City,Address,Phone,Email,Lat-Long
Ocean Gateways,Companies(Private),Anta,,,"yogendra.kumar@isapindia.org,,Anta-firme@2x-1024x332.png,",
Nainas Apparel Pvt Ltd,Companies(Private),Anta,"13, New Majestic Shopping Centre, 144, JSS Road, Girgaum, Mumbai 400007, MH",+91-22-23860648,"info@tatapetrodyne.in,,rpkhedkar@rediffmail.com,",
SeQuent Scientific Ltd,Companies(Private),Anta,"301/A, Plot No E-7, 'Dosti Pinnacle', Wagle Industrial Area, Road No 22, Thane West, Mumbai 400604, MH",,",x3ejane.doe@sequent.in,marketing@sequent.in,infohplindia@gmail.com,ceohplindia@gmail.com,jane.doe@sequent.in,last@sequent.in,",
Sethia Sweet Products,Companies(Private),Anta,"262, Bichwal Industrial Area, Bikaner 334006, RJ",+91-9413389692,,
Noble Agro Food Products Pvt Ltd,Companies(Private),Anta,"19, Opposite Gokuldham, Mercedez Banz Street, Ullaria Patia, Sarkhej Sanand Highway, Sanathal, Ahmedabad 382210, GJ","+91-79-65432320, +91-79-65530938","nobleagro@yahoo.com,nnoble@snackspellets.com,,",
Link Logistics,Companies(Private),Anta,"603, B-Wing, Naman Midtown, S B Marg, Elphinston West, Mumbai 400009, MH","+91-22-32561482, +91-9321241900","AntaSportsIR@citigatedewerogerson.com,,china@linklogistics.com.cn,",
Cargo Plan International India Pvt Ltd,Companies(Private),Anta,"909/910, 9th Floor, Sushant Lok, Phase 1, Gurgaon 122002, HR",-4824533,",x3ejulian@maa.cargoplanindia.com,julian@maa.cargoplanindia.com,",
