Name,Sector,City,Address,Phone,Email,Lat-Long
MH Polymers Pvt Ltd,Companies(Private),Kangayam,"D-2/A, Abul Fazal, Enclave Thokar 3, Jamia Nagar, Okhla, New Delhi 110025, DL",+91-11-23941799,",j_doe@freshupmattresses.com,info@mhpolymers.com,polymers@sivasakthi.in,",
Dash n Dots,Companies(Private),Kangayam,"31/1, 3rd Floor, Shanti Road, Shantinagar, Bangalore 560027, KA","+91-80-22110633, +91-80-22116426",",bkhandual32@gmail.com,",
Nirlon Ltd,Companies(Private),Kangayam,"Western Express Highway, Pahadi, Goregaon East, Mumbai 400063, MH","+91-22-26852256, +91-22-26852257",",Info@Textilebasket.Com,uniqueindustrial@gmail.com,info@nirlonltd.com,",
Des Ceramica Pvt Ltd,Companies(Private),Kangayam,"432, Naigaum Cross Road, Wadala, Mumbai 400031, MH","+91-22-24121176, +91-22-24128670",",desceramica@gmail.com,despa.tel@gmail.com,",
A. R. Enterprises (Alif Oven),Companies(Private),Kangayam,"213, B Wing, 2nd Floor, Kanara Business Centre, Laxmi Nagar, Ghatkopar East, Mumbai 400075, MH","+91-22-25007860, +91-22-25007696",",alifovens@gmail.com,","14.9780437,69.9431172"
