Name,Sector,City,Address,Phone,Email,Lat-Long
Parikh EnergySystems Pvt Ltd,Companies(Private),Jamshedpur,"131, Sarita, Prabhat Industrial Estate, Near Toll Naka, Western Express Highway, Dahisar 400068, MH",+91-22-28283160,",rajeev.ranjan@lumbinielite.com,rakesh.shejwal@aartigroup.cominfo,support@purvashare.com,ufc.fcp@fortunehotels.in,kinjal.parikh@hnsafal.com,",
Jatson Power Pvt Ltd,Companies(Private),Jamshedpur,"1-A, 5406, Near 66 KV Substation, 4th Phase, G.I.D.C., Vapi 396195, GJ",+91-260-2425882,,
Aabhushan jwellers,Companies(Private),Jamshedpur,"FA-5, Crown Plaza, Near Ajronda Chowk, Sector 15-A, Faridabad 121007, HR",-9999879543,",aabhushan2008@gmail.com,shafeekh@malbargroup.com,",
GBC India,Companies(Private),Jamshedpur,"A/408, Neelkanth Palace, 100 feet Road, Satelitte, Ahmedabad 380015, GJ",-9825070534,",pe.jamshedpur@bankofbaroda.com,",
Tatva Chintan Pharma Chem Pvt Ltd,Companies(Private),Jamshedpur,"502-17, GIDC Estate, Ankleshwar 393002, GJ","+91-2646-253593, +91-2646-238991","ramakrishnan.kannan@sivagroup.in,geetapuri.seth@atctower.in,ramakrishnan.kannan@sivagroup.in,info.india@ocs.co.uk,x3egeetapuri.seth@atctower.in,",
Nandira Chemicals,Companies(Private),Jamshedpur,"1, Suyog, Opposite Lokmanya Society, Savarkar Marg, Thane 421002, MH",-25420180,"hr@adani.in,nationalenterprise99@gmail.com,hr@adani.in,rs@rkvlogistics.mumbai,",
Auto Polymers,Companies(Private),Jamshedpur,"Plot No 30, Athani Industrial Estate, Peringandur, Thrissur 680581, KL","+91- 0487-, +91-9447992238",,
Ganesh Watch Co,Companies(Private),Jamshedpur,"558, Khadke House, Near Shani Mandir, Raviwarpeth, Nashik 422001, MH",+91-253-2577691,"amol_gwc@yahoo.co.in,",
