Name,Sector,City,Address,Phone,Email,Lat-Long
Markit India Services Pvt Ltd,Companies(Private),Vadodara,"7th And 8th Floor, Tower B, DLF Cyber Greens, Phase 3, DLF Cyber City, Gurgaon 122010, HR",+91-124-6696610,"xxxx@markit.com,vadodara@linkintime.co.in,info@plindia.com,corpsec.india@ihsmarkit.com,hr@adani.in,",
Margadarsi Chit Fund Pvt Ltd (Ramoji ),Companies(Private),Vadodara,"Margadarsi House, 5-10-195, Opposite Police Control Room, Fatehmaiden Road, Nampally, Hyderabad 500004, TS","+91-40-23442160, +91-9701450150, +91-9701556656","x3efinal-accounts@mail.margadarsi.com,final-accounts@mail.margadarsi.com,enrol@margadarsi.com,",
M S N Securities Pvt Ltd,Companies(Private),Vadodara,"108, Veena Chambers, Dalal Street, Fort, Mumbai 400001, MH",+91-22-66356300,"mehrab@msnsecurities.com,gvk1hyd@gmail.com,",
JHP Securities Pvt Ltd,Companies(Private),Vadodara,"201B, Dev Neo Vikram, Sahakar Nagar, Above Audi Car Showroom, New Link Road, Andheri West, Mumbai 400053, MH",+91-22-40824242,"hello@jhpsecurities.com,cdsl@jaypeecapital.com,jspl.jhp@jhpsecurities.com,",
Fortune InterFinance Ltd,Companies(Private),Vadodara,"19, British Indian Street, Flat 2 & 3, Kolkata 700069, WB",+91-33-22101152,"fifl.1994@yahoo.com,unitedfortuneltd@yahoo.in,subhendu@ascarbon.com,fortunefiscal@yahoo.co.in,Rekha.srivastava2016@gmail.com,",
A C Choksi Share Brokers Pvt Ltd,Companies(Private),Vadodara,"2nd Floor, ITTS House, 33 Shree Saibaba Marg, Kalaghoda, Fort, Mumbai 400001, MH","+91-22-22044000, +91-22-61595100","depository@acchoksi.com,acchoksi@acchoksi.com,u003eacchoksi@acchoksi.com,account@acchoksi.com,",
Bharat Re- Insurance Brokers Pvt Ltd,Companies(Private),Vadodara,"New 6, Old 12, Poes Road, Tenumpet, Chennai 600018, TN",+91-44-43418700,"jxxxxa@bharatre.in,support@bharatre.in,x22sridharbroker@yahoo.co.in,sridharbroker@yahoo.co.in,x3esridharbroker@yahoo.co.in,",
Clinigene International Ltd,Companies(Private),Vadodara,,,"kiran.kumar@biocon.com,productqueries@cipla.com,",
