Name,Sector,City,Address,Phone,Email,Lat-Long
Strata Geosystems India Pvt Ltd,Companies(Private),Boisar,"Plot No A-15/16, Sabnam House, Behind MIDC, Central Cross Road, Andheri East, Mumbai 400093, MH",+91-22-40635100,",x22jrk@strataindia.com,last@strataindia.com,jrk@strataindia.com,x3ejrk@strataindia.com,","19.1171737,72.8578172"
Varadhasta Plastics and Packaging Pvt Ltd,Companies(Private),Boisar,"301, Mahim Industrial Estate, Mori Road, Mahim West, Mumbai 400016, MH",-24464391,,
Shreenathji Industries,Companies(Private),Boisar,"Plot No 3409, Phase 4 GIDC, Vatava, Ahmedabad 382445, GJ","+91-79-40083478, +91-79-40083479",,
Arcee Industries Ltd,Companies(Private),Boisar,"7th, KM Barwala Road, Talwandi, Hisar 125001, HR",+91-1662-276178,"bcpl_calcutta@bcplindia.com,bcpl_calcutta@bcplindia.com,bcpl_calcutta@bcplindia.com,support@navpad.in,support@navpad.in,support@navpad.in,ram@alphaogm.com,ram@alphaogm.com,ram@alphaogm.com,rockdude232@gmail.com,rockdude232@gmail.com,rockdude232@gmail.com,rakesh.shejwal@aartigroup.cominfo,ariseimpex@gmail.com,ariseimpex@gmail.com,arisegroup@hotmail.com,corporate@ariseindialtd.com,rakesh.shejwal@aartigroup.cominfo,x22bcpl_calcutta@bcplindia.com,x3ebcpl_calcutta@bcplindia.com,x3ebcpl_calcutta@bcplindia.com,x22support@navpad.in,x3esupport@navpad.in,x3esupport@navpad.in,x22ram@alphaogm.com,x3eram@alphaogm.com,x3eram@alphaogm.com,x22rockdude232@gmail.com,x3erockdude232@gmail.com,x3erockdude232@gmail.com,",
Sapwood Ventures Pvt Ltd,Companies(Private),Boisar,"803-A, Ashok Gardens Jivraj Thakersi Marg, Parel-Sewri, Mumbai 400015, MH","+91-22-24170609, +91-9870106520","anil@scillz.com,",
