Name,Sector,City,Address,Phone,Email,Lat-Long
Safeducate Learning,College,Thane,"Barve road C-4, Wagle industrial estate Institute of Management & computer studies, Opp AAP labs, Thane West, Maharashtra 400604",1800 11 0113,",enquiry@safeducate.com,","19.1877101,72.9522561"
Mediscan Systems,College,Thane,"Vedant Shopping Complex, Near Tip Top Mithaiwala, Vartak Nagar, Thane West, Thane - 400601",022 3216 8849,",alpinenabl@gmail.com,clab@yenepoya.edu.in,training@mediscan.org.in,gargi@salvusglobal.com,","19.2130215,72.9589143"
Nitra Institute of Sleep Sciences,College,Thane,"5XP9+XGV, Second Floor, Nest Hospital, Behind State Bank of India, Near Ice Factory, Off Gokhale Road, Naupada, Thane West, Maharashtra 400602",081085 58111,",info@nithra.com,appointmentiiss2010@gmail.com,mail@nitratextile.org,admissionbtech@nitra.ac.in,","19.1874963,72.9585079"
"Moople Institute of Animation and Design, Topsia",College,Thane,"Balganesh co-operative society 2nd floor, 203/204/205 Dada Patil Marg, Next, Thane Station Rd, Thane West, Maharashtra 400602",081009 82727,",info@moople.in,","19.1869009,72.9722669"
"Moople Institute of Animation and Design, Madhyamgram",College,Thane,"Balganesh co-operative society 2nd floor, 203/204/205 Dada Patil Marg, Next, Thane Station Rd, Thane West, Maharashtra 400602",081009 82727,",thane@moople.in,","19.1869009,72.9722669"
George ITES,College,Thane,"B Wing, Arihant Aura, Plot No. 13/1, Office No. 1402, 14th, Thane - Belapur Rd, TTC Industrial Area, Turbhe MIDC, Turbhe, Navi Mumbai, Maharashtra 400705",,",itesmumbai@yahoo.com,cssl.investors@cybertech.com,itesmumbai@gmail.com,nsbarse@vpmthane.org,x3einquiry@cognizant.com,inquiry@cognizant.com,","19.075273,73.0166909"
Indian Institute of Job-Oriented Training (IIJT - Retail),College,Thane,"6, Gokhale Rd, Shivaji Path, Naupada, Thane West, Thane, Maharashtra 400602",098333 63472,,"19.1879495,72.9710131"
"Shree L. R. Tiwari Degree College of Arts,Commerce and Science, Mira Bhayandar[2]",College,Thane,"near by RIS, Shree L.R Tiwari Educational Campus, Kanakia Park, Mira Road East, Thane, Mira Bhayandar, Maharashtra 401107",093725 85182,"slrtdc@rahuleducation.com,,Emailslrtdc@rahuleducation.com,slrtce@rahuleducation.com,","19.2999424,72.873287"
"Seth N.K.T.T College of commerce arts and science, kharkaralii road Thane West",College,Thane,"Ganpat Jairam Kharkar Ali Marg, behind Collector Office, Kharkar Alley, Thane West, Thane, Maharashtra 400601",022 2543 1119,",nkttdg@yahoo.co.in,nktdegreecollege@rediffmail.com,","19.1961404,72.9771337"
A. P. Shah Institute of Technology - Thane,College,Thane,"Survey No, 12, Ghodbunder Rd, opp. Hypercity Mall, Bhawani Nagar, Kasarvadavali, Thane West, Thane, Maharashtra 400615",077383 05400,",reception@apsit.edu.in,principal@apsit.edu.in,dkjain@apsit.org.in,","19.2680375,72.9646696"
"Rustomjee Academy for Global Careers, Thane",College,Thane,"4th Floor, Rustomjee Cambridge International School, Rustomjee Urbania, West, near Rabodi, Majiwada, Thane, Maharashtra 400604",086550 52850,",Emailkaran@ragc.in,info@ragc.in,enquiries@ragc.rustomjee.com,","19.207325,72.9851865"
"Shivajirao S. Jondhale College of Engineering, Dombivali",College,Thane,"Sheel-Kalyan Road, Sonarpada, Post, Manpada Rd, behind Venkatesh Petrol Pump, Dombivli East, Thane, Maharashtra 421204",095949 62013,"vjtsscoe@rediffmail.com,,domb@gmail.com,office@shivajiraojondhalecoe.org.in,office@shivajiraojondhalecoe.com,","19.1979574,73.1057092"
"Dr V N Bedekar Institute of Management Studies, Thane West",College,Thane,"Building No. 4, Jnanadweep, Chendani Bunder Road, Jambli Naka, Thane West, Thane, Maharashtra 400601",022 2536 4492,"VNBRIMS@VPMTHANE.ORG,,u003evnbrims@vpmthane.org,vnbrims@vpmthane.org,upc@vpmthane.org,","19.1890998,72.9778497"
"University of Mumbai, Thane Sub Campus, Thane",College,Thane,"6XGP+3VJ, University Rd, Behind Runwal Garden City, Balkum Pada, Thane West, Thane, Maharashtra 400608",022 2533 9323,",contact@lawbhoomi.com,santoshrathod@idol.mu.ac.in,registrar@fort.mu.ac.in,director@idol.mu.ac.in,x3eregistrar@fort.mu.ac.in,thanesubcampus@mu.ac.in,Admissions.mutc@old.mu.ac.in,x3edirector@idol.mu.ac.in,","19.2252119,72.9845669"
"Institute of Management and Computer Studies, Thane West",College,Thane,"C-4, Wagle Industrial Estate, Near Mulund Check Naka, Thane West, opp. Aplab, Mumbai, Maharashtra 400604",022 2583 2466,",director@imcost.org,imcost@rediffmail.com,","19.187722,72.9522714"
Viva Institute Of Pharmacy,College,Thane,"Shirgaon, Veer Savarkar Marg, Virar East, Vasai, Thane, Maharashtra 401303",0250 699 0999,",Emailpharmacy@vivacollege.org,pharmacy@vivacollege.org,u003epharmacy@vivacollege.org,sunitaogale@vivapharmacy.org,","19.4738066,72.8556928"
"Rustomjee Academy for Global Careers,[8] Thane",College,Thane,"4th Floor, Rustomjee Cambridge International School, Rustomjee Urbania, West, near Rabodi, Majiwada, Thane, Maharashtra 400604",086550 52850,"Emailenquiries@ragc.rustomjee.com,Emailkaran@ragc.in,info@ragc.in,,","19.207325,72.9851865"
K.C.College of Engineering and Management Studies and Research,College,Thane,"Mithbunder Rd, near Sadguru Gardens, Kopri, Thane East, Thane, Maharashtra 400603",022 2532 6085,",askmeanything@kccollege.edu.in,office@kccollege.edu.in,Emailinfo@kccemsr.edu.in,","19.1799707,72.9778504"
Council of Education and Development Programmes,College,Thane,"501, 5th Floor, New English High School, Ram Maruti Rd, Near Talao Pali, Thane West, Maharashtra 400602",,",cedptrust@gmail.com,cedpdirector@gmail.com,","19.19109,72.9700307"
IANT - Institute of Advance Network Technology,College,Thane,"3rd Floor, Kosmic Arcade Near Kunj Vihar, opp. S.T Stand Road, Thane West, Thane, Maharashtra 400601",,",contact@iantindia.com,","19.187357,72.9742546"
Safety Rise Institute of Fire and Safety Management,College,Thane,"306, Oracle Business Hub, Rd Number 16, Brodma, Ambica Nagar, Wagle Industrial Estate, Thane West, Thane, Maharashtra 400604",098198 27014,",niifsthanemumai@gmail.com,info@safetyrise.com,","19.1977804,72.9534755"
"Saraswati Distance Education, Andheri East",College,Thane,"109, first floor, paraside tower, nr.mc donald, Gokhale Rd, opp. Alok Hotel, Thane, Maharashtra",,",saraswathicollege1597@gmail.com,principal.scoe@gmail.com,saraswaticollege1597@gmail.com,","19.1872424,72.9681426"
"Swami Vivekanand College of Distance Education,Mira Road",College,Thane,"Shop No. 15, Ostwal Shopping Center, Near Bhayandar East, Thane, Maharashtra 401105",,",info@swamivivekanandcollege.net,","19.3127796,72.8504838"
Dnyanganga College of Education,College,Thane,"7X66+F6W, Ghodbunder Rd, behind Hypercity Mall, Kasarvadavali, Thane West, Thane, Maharashtra 400615",022 2597 3273,",dgets_college@yahoo.co.in,career@dgetcollege-edu.org,dgetsbed@gmail.com,dgets_school@yahoo.in,","19.2612348,72.9579894"
"Clinomic Center for Clinical Research Pvt. Ltd., Andheri West",College,Thane,"Office No 407, Shivam IT park, Plot No.A, 198, Ambica Nagar, Wagle Industrial Estate, Thane West, Thane, Maharashtra 400604",091378 16889,",hr@clinomic.in,jasminepriyadarsh@gmail.com,","19.1980512,72.9536145"
"Rustomjee Academy for Global Careers, Thane",College,Thane,"4th Floor, Rustomjee Cambridge International School, Rustomjee Urbania, West, near Rabodi, Majiwada, Thane, Maharashtra 400604",086550 52850,",Emailkaran@ragc.in,info@ragc.in,enquiries@ragc.rustomjee.com,","19.20732,72.9851865"
"Arena Animation, Mira Road",College,Thane,"103, A 61 Amisha, Sector 1, Shanti Nagar, Mira Road East, Thane, Maharashtra 401107",,"arena.thane@gmail.com,,x3ecustomercare@arena-pakistan.com,customercare@arena-pakistan.com,","19.2802881,72.8554446"
"Explore The World Travel Academy, Thane West",College,Thane,"Sai Krupa Apartment, 116 Awing, Amrut Nagar, Mumbra, Thane, Maharashtra 400612",,",info@etwtravelacademy.com,","19.1875124,73.0193787"
Pinnacle School of Business Management (PSBM),College,Thane,"PSBM, 304, Nav Kirti Premises,, Commerce Point,, opp. Railway Station, Bhayander (East), Thane, Maharashtra 401105",,"exam@psbm.org,,enquiry@psbm.org,Mumbai@psbm.org,mumbai@psbm.org,examquery@psbm.org,edu@psbm.org,mumbai@psdm.org,","19.3114958,72.8505918"
"JD Institute of Fashion Technology, Thane",College,Thane,"Building No.1, JD Institute Of Fashion Technology, 102, Ratnamani Building, Dada Patil Wadi, opposite Railway Platform, near Appetite Momos, Thane West, Thane, Maharashtra 400062",,"mumbai@jdindia.com,,jdfashion@jdindia.com,","19.2173396,72.9758521"
Indian Institute of Professional Excellence,College,Thane,"57B/13, Brindaban society,, Majiwada, Thane West, Maharashtra 400601",,",career@vpmthane.org,info@ipemgzb.ac.in,","19.2096429,72.9821191"
QuickXpert Infotech,College,Thane,"railway station, 101 Prestige Chambers, Station Road, Besides Maurya Hotel, opp. Thane west, Thane, Maharashtra 400601",075062 52588,",inquiry@quickxpertinfotech.com,info@quickxpert.com,","19.186858,72.9739408"
Reliance Institute of Life Sciences,College,Thane,"42Q3+C9G, of MIDC, R-282, Thane - Belapur Rd, T.T.C. Industrial Area, MIDC Industrial Area, Rabale, Navi Mumbai, Maharashtra 400701",,",x3eRLS.CompanySecretary@Relbio.com,director@rils.ac.in,RLS.CompanySecretary@Relbio.com,higher.education@zmail.relbio.com,","19.139211,73.0018823"
