Name,Sector,City,Address,Phone,Email,Lat-Long
Kothari Brothers,Companies(Private),Rajpur,"9, 136, 2, Govindappa Naicken Street, Parrys, Chennai 600001, TN",+91-44-9953354100,",finance@merlinprojects.com,villagerugs.company@gmail.com,nisaralibkn0007@gmail.com,",
Suryavanshi Spinning Mills Ltd,Companies(Private),Rajpur,"105, 6th Floor, Surya Towers, Sardar Patel Road, Secunderabad 500003, AP",+91-40-30512700,",x3esatinkatyal@vardhman.com,info@suryavanshi.com,satinkatyal@vardhman.com,jane-d@suryavanshi.com,",
Sidwin Fabric Pvt Ltd,Companies(Private),Rajpur,"898, Gambhoi Harsol Road, Dhundhar, Himatnagar 383030, GJ",+91-2772-250131,",info@sidwinfabric.com,md@sidwinfabric.com,account@sidwinfabric.com,x3eaccount@sidwinfabric.com,",
Anzen Exports,Companies(Private),Rajpur,"157, Sarat Bose Road, Kolkata 700026, WB",,",x3einfo@anzen.co.in,info@anzen.co.in,",
Jagtap Nursery,Companies(Private),Rajpur,"Behind Magarpatta Seasons Mall, Magarpatta, Pune 411013, MH","+91-22-67231955, +91-8380099255","info@jagtapnusery.com,,",
NatureGreen Exports,Companies(Private),Rajpur,"1-C, 37, AJI Industrial GIDC, Opposite Dynematic Forging, Rajkot 360003, GJ",+91-281-2387758,,"22.2765417,70.7757033"
Guddi Plastcon Pvt Ltd,Companies(Private),Rajpur,"214-B/215, Kanara Business Centre, Behind Everest Gardens Building, Laxmi Nagar, Ghatkopar East, Mumbai 400077, MH",+91-22-61579393,",accounts@guddiindia.com,","19.0920318,72.9066092"
Mercedes Benz Research and Development India Pvt Ltd,Companies(Private),Rajpur,"EPIP Zone, Phase 1, Whitefield Road, Bengaluru 560066, KA",+91-80-67685025,"last@daimler.com,dialog@mercedes-benz.com,",
